Exporter Name,Address,District,State
S.M. APPARELS,"SF NO. 495, 1/B, Main Rd, Poonthottam, Palavanchipalayam, Kallangadu, Tiruppur, Tamil Nadu 641604, India",,Tamil Nadu
S.P.A. EXPORTS,"110-E, VELUSAMYPURAM, THIRUVALLUVAR NAGAR ,KOTHUR ROAD, Karur, Tamil Nadu 639002, India",,Tamil Nadu
S.P.P ENTERPRISES,"No.160/6A, National Highway, Taluk, Mambakkam, Sriperumbudur, Tamil Nadu 602106, India",,Tamil Nadu
SAANVI EXPORTS,"11/390A Vishakapuram, Mangalapuram, PO, Kanjikuzhy, Thamarachal, Muhamma, Kerala 688525, India",,Kerala
SABARE APPARELS,"Pappanaickan Palayam Main Road, Tirupur, 49C4+XP5, Golden Nagar, Papanayakan Palayam, Tiruppur, Tamil Nadu 641607, India",,Tamil Nadu
SAINA EXPORTS,"P. H WARD, AS ROAD, Kommady, Alappuzha, Aryad South, Kerala 688001, India",,Kerala
SAM TURBO INDUSTRY,"Avinashi Rd, Neelambur, Tamil Nadu 641062, India",,Tamil Nadu
SAMRAJ ENGINEERING CONTROLS P.LTD.,"641035, MGR Nagar, Saravanampatti, Coimbatore, Tamil Nadu 641035, India",,Tamil Nadu
SARVA GROUP GLOBAL,"Dubai Rd, Ponnuparambil, Guruvayur, Kerala 680104, India",,Kerala
SATURN EXPORTS,"482M+PMW, Rayapuram Extension, Pethi Chetti Puram, Rayapuram, Tiruppur, Tamil Nadu 641601, India",,Tamil Nadu
SEAGULL ASSOCIATES,"1/805, Sri Paranthaman Nagar, Dharapuram Main Rd, K Chettipalayam, Tiruppur, Tamil Nadu 641608, India",,Tamil Nadu
SHALOM GLOBAL EXPORTS,"436, Mudichur Rd, West Tambaram, Tambaram, Chennai, Tamil Nadu 600045, India",,Tamil Nadu
SHAMBALA TRADERS,"PWQW+3X8, Kallakurichi - Kachirapalayam Rd, Kallakurichi, Tamil Nadu 606202, India",,Tamil Nadu
SIVI EXPORTS,"Rajivee Nager, 499H+RH7, 3rd St, Parappalayam, Tiruppur, Tamil Nadu 641607, India",,Tamil Nadu
SKD EXPORTS,"491/2, Poompuhar Nagar, Total Gas Back Side, Palladam Road, Sheriff Colony Extension, Tiruppur, Tamil Nadu 641604, India",,Tamil Nadu
SMS EXPORTERS,"2/175,kondegoundenpalayam,Negamam, Pollachi, Tamil Nadu 642120, India",,Tamil Nadu
SPECIFIED RUBBERS (P)LTD.,"Kanjikuzhi, Kottayam, Kerala 686002, India",,Kerala
SPICE PLANTERS,"4CXG+C9C, Kanjoor, Kerala 683575, India",,Kerala
SREE ANJANEYA EXPORTS,"25, Karuppanan Kovil Thottam, Vanjipalayam, Mettuvalasu(PO, Tk, Dharapuram, Tamil Nadu 638661, India",,Tamil Nadu
SREE ANNAMALAI TEX,"83/50, MC Rd, NN Garden, Washermanpet, Chennai, Tamil Nadu 600021, India",,Tamil Nadu
SREE BALAJI  INTERNATIONAL,"8/328/A, Ponnammal Nagar, ,8th Street,Pooluvapatti (PO),, Pooluvapatti, Tiruppur, Tamil Nadu 641602, India",,Tamil Nadu
SREE SIVAMURUGAN KNIT COMPACTERS,"382, TNK Towers 4th Street, Kongu Main Rd, Appachi Nagar, Kongu Nagar, Tiruppur, Tamil Nadu 641607, India",,Tamil Nadu
SREE VEILA KNIT FAB,"Venkatachalapathy nagar, 49FF+5VM, Parapalayam Rd, Sathya Colony East, Tiruppur, Tamil Nadu 641607, India",,Tamil Nadu
SREE VELAN CLOTHINGS,"22, East St, Thennampalayam, Tiruppur, Tamil Nadu 641604, India",,Tamil Nadu
SRI ADITYA GARMENTS,"39P5+H29, 8th Street, Gopal Nagar, Velliangadu, Tiruppur, Tamil Nadu 641608, India",,Tamil Nadu
SRI AGARAM IMPEX,"No.3/33-9 Annamalai Nagar, Kovai Main Rd, near Muniyappan Kovil, Karur, Tamil Nadu 639002, India",,Tamil Nadu
SRI ASMANTH IMPEX,"3W5W+9R8, Gounder Mills, Coimbatore, Tamil Nadu 641029, India",,Tamil Nadu
SRI PARASAKTHI TEXTILES,"Sivasakthi Nagar, Komarapalayam, Tamil Nadu 638183, India",,Tamil Nadu
SRI RANGANATHAR INDUSTRIES,"12/45, Thadagam Main Rd, Edayarpalayam, Coimbatore, Tamil Nadu 641025, India",,Tamil Nadu
SRI VETRI VEL EXPORTS,"FX24+Q7V, Innasiyarpuram, Thadikombu, Tamil Nadu 624709, India",,Tamil Nadu
STERLING PRINT HOUSE P.LTD.,"Door No. 49, 1849, Cheranalllur Rd, Ponekkara, PO, Kochi, Kerala 682041, India",,Kerala
STONE APPARELS,"Angeripalayam Main Rd, Mahavishnu Nagar, Pitchampalayam Pudur, Tiruppur, Tamil Nadu 641603, India",,Tamil Nadu
SUBI EXPORTS,"#21A, Ramraj Nagar, Gandhinagar, PO, Tiruppur, Tamil Nadu 641603, India",,Tamil Nadu
SUGANTHAM CREATIONS,"641604, Palladam Main Rd, Sheriff Colony Extension, Tiruppur, Tamil Nadu 641605, India",,Tamil Nadu
SUPRA EXIM,"D.NO.4, 136/2, Anandha Iyengar Street, NGGO Colony, Coimbatore, Thudiyalur, Tamil Nadu 641022, India",,Tamil Nadu
SURYA TOOLS CENTRE,"Vyabharabavan Bldg. Ground floor NH road, Dt, Puthanathani, Kerala 676552, India",,Kerala
SUSIN I-TORK INDIA P.LTD.,"4XJ2+7GV, Tamil Nadu 641022, India",,Tamil Nadu
TBLR EXPORTS P.LTD.,"Natesa Gounder St, Ganapathy, Coimbatore, Tamil Nadu 641006, India",,Tamil Nadu
TEXWIN IMPEX,"5, R.V.E Nagar, Ist Street Privu, Kangayam Rd, Rakkiyapalayam, Tiruppur, Nachipalayam, Tamil Nadu 641604, India",,Tamil Nadu
THAIMADAM MACHINES,"CHX3+3RC, Changanassery Bypass, Kunnakkad, Fathimapuram, Changanassery, Kerala 686101, India",,Kerala
THEKKADY AGRO PRODUCTS,"Thekkady, Kumily, Kerala, India",,Kerala
THIRUKUMARAN FIBRES,"3/8, V.G.Pudur Ammapati (P. O, Udumalaipettai, Tamil Nadu 642205, India",,Tamil Nadu
THURAN COIR MILLS,"179/2A, Rangasamudhram Suleeswaranpatti, Annantha Nagar, Pollachi, Tamil Nadu 642006, India",,Tamil Nadu
TIRUPUR CITY STYLE COLLECTION,"Tiruppur, Tamil Nadu, India",,Tamil Nadu
TIRUR COCONUT TRADERS,"WWMP+M2M, Thalakkadathur, Tirur, Kerala 676103, India",,Kerala
TRAVANCORE POLYMERS P.LTD.,"Panthackal - Chirangara Road, Panthackal,, Paduapuram P.O, Angamaly, Kerala 683576, India",,Kerala
TRILOCHAN COCOS,"Sf No 356/2, post, Vellaiyagoundanur, Mannur, Pollachi, Tamil Nadu 642005, India",,Tamil Nadu
TRIVIKRAM FLOWTECH,"21, Indira Nagar, Gopalasamy colony, Thadagam Main Rd, PMR Nagar, KNG Pudur Pirivu, Coimbatore, Tamil Nadu 641025, India",,Tamil Nadu
TROPICAL BATH SOLUTIONS P.LTD.,"34/136 A,C,H Florence, NH Ln, Edappally, Kochi, Kerala 682024, India",,Kerala
UNICLEAN HYGIENE SOLUTIONS,"United tower 2nd floor .opposit highway hypermarket, Mannarkkad Rd, KSHB Colony, Perintalmanna, Kerala 679322, India",,Kerala
UNIQUE IMPEX,"284-C, AMUTHAM NAGAR, 40FT ROAD, Vaiyapuri Nagar, Green Lands, Karur, Tamil Nadu 639002, India",,Tamil Nadu
V.COOL EXPORTS,"Sf 102, Kasi Palayam Main Road, Vijayapuram, S I D C O, Tiruppur, Tamil Nadu 641606, India",,Tamil Nadu
V.M.POLYTEX LTD.,"V.M.POLYTEX LIMITED, Kanjikode, Pudussery Central, Kerala 678621, India",,Kerala
V.MAGAASH GARMENTS,"Ganapathipalayam Rd, Chinnakarai, Tiruppur, Tamil Nadu 641605, India",,Tamil Nadu
VASANTHA MODERN RICE MILL,"146 main road, kondikulam, Alivalam, post, Pattukkottai, Kondikulam, Tamil Nadu 614602, India",,Tamil Nadu
VASU KNITING,"58CQ+JM5, Unnamed Road, Kaalampalayam, Tiruppur, Tamil Nadu 641603, India",,Tamil Nadu
VEE BEE GARMENTS,"28Q6+WJ9, Sedapalayam Rd, MGR Nagar, Arulpuram, Tiruppur, Tamil Nadu 641604, India",,Tamil Nadu
VEE CEE EXPORTS ,"152 1, Chandrapuram, K S Gardens, Knp Colony, Post, Dharapuram Road, Dharapuram Road, Renganatha Puram, Tiruppur, Tamil Nadu 641608, India",,Tamil Nadu
VEE SEVEN ENGINEERING,"Koorkenchery, Thrissur, Kerala 680007, India",,Kerala
VEEYES ENGINEERING,"S.F.No. 489/5, 490/1&3, Kondayam Palayam Road, Keeranatham Village Post, MGR Nagar, Saravanampatti, Coimbatore, Tamil Nadu 641035, India",,Tamil Nadu
VELLAN GLOBAL,"S.F No. 219/2D Sarathy Lane, Annamalai Industrial Estate, Sharp Nagar, Nehru Nagar West, Kalapatti, Coimbatore, Tamil Nadu 641048, India",,Tamil Nadu
VENUS MEDICALS,"QF7J+F63, Palissery, Thalassery, Kerala 670104, India",,Kerala
VENUS PHOTO WORLD,"Palace Rd, near UCO BANK, Changanassery, Aramanapady, Kottayam, Changanassery, Kerala 686101, India",,Kerala
VICTUS DYEINGS,"Chinnakarai, Tiruppur, Murugampalayam, Tamil Nadu 641604, India",,Tamil Nadu
VINAYAG CLOTHING COMPANY,"39PR+GW7, Tiruppur, Tamil Nadu 641606, India",,Tamil Nadu
VISHNU TRADERS,"Tc 43/1318, Swara-50, near, Uppidamoodu Bridge, Nalumukku, Fort p.o, Thiruvananthapuram, Kerala 695023, India",,Kerala
VISWAK CREATIONS,"Poyampalayam, Tiruppur, Tamil Nadu 641603, India",,Tamil Nadu
VTN GARMENTS,"SF No. 264/1B,Kulathottam,Kangeyam Main Road, Vijayapuram Post Near Vijayapuram Pirivu, Opposite to Bright Public School, Tiruppur, Tamil Nadu 641606, India",,Tamil Nadu
VVR GLOBAL EXPORTS,"No.3, Kadalaikarar St, Sivagami Puram, Virudhunagar, Tamil Nadu 626001, India",,Tamil Nadu
WELLKNIT APPARELS P. LTD.,"A-12 & A-14, Madras Export Processing Zone Rd, West Tambaram, Tambaram, Chennai, Tamil Nadu 600047, India",,Tamil Nadu
WESTERN GHAT,"Western Ghats, Kannan Devan Hills, Kerala 685561",,Kerala
WILMAX INDIA,"# Ponnurunni, Convent Road, X8F6+9FM, Near Bank of India, Vyttila, Ernakulam, Kochi, Kerala 682035, India",,Kerala
WINS EXPORTS,"1/B, Rakkiyapalayam Pirivu, Kangayam Road, Viyajapuram Post, Kangayam Road, RVE Nagar, Valliammai Nagar, Tiruppur, Tamil Nadu 641604, India",,Tamil Nadu
WORLDTEX INTERNATIONAL,"61, Nesavalar Colony St, Thirumalai Nagar, Nesavalar Colony, Tiruppur, Tamil Nadu 641602, India",,Tamil Nadu
YES JAY KNIT CORPORATION,"48M6+WV6, Velampalayam, A.Thirumuruganpoondi, Tamil Nadu 641652, India",,Tamil Nadu
YODHA EXPORTS,"No.25(1st floor, Subramania, Eashwaran Koil 1st St, opp. Pallavaram Railway Station, Kulathuma Nagar, Zameen, Pallavaram, Chennai, Tamil Nadu 600043, India",,Tamil Nadu
A TO Z PACKAGINGS,"Chennampilly Ln, Cheranallur, Kochi, Kerala 682034, India",,Kerala
A.I. ENTERPRISES,"30/17 B, Dairy Rd, Pattravakkam, Tiny Sector, Sidco Industrial Estate, Ambattur, Chennai, Tamil Nadu 600098, India",,Tamil Nadu
A.K.S.EXIM INDIA,"No 75, G,V Complex ,Chinnerivayakadu, Pallapatti, Salem, Tamil Nadu 636009, India",,Tamil Nadu
ABHEK LIFE STYLES,"385V+JCW, HMT Colony, North Kalamassery, HMT Kalamassery, Kochi, Kerala 683503, India",,Kerala
ABI EGG TRADERS,"Senthil Complex, Mohanur Main Rd, Namakkal, Tamil Nadu 637001, India",,Tamil Nadu
ABU IMPEX,"70, 87, Shaik Maistry St, Subba Road Avenue, Pudumanaikuppam, Royapuram, Chennai, Tamil Nadu 600013, India",,Tamil Nadu
AFFORD EXIM,"XII/107F, K.K.Paraman memorial Building, Karimpadam Junction, Chennamagalam, Bharanimukku, North Paravur, Chendamangalam, Kerala 683512, India",,Kerala
AIRTEK COMPRESSORS,"29B SOWRIPALAYAM MAIN ROAD NEAR MEENA ESTATE, BUS STOP, Chinna Ayyavu Thevar Layout, Sowri Palayam, Coimbatore, Tamil Nadu 641028, India",,Tamil Nadu
AISWARYA POLYMERS,"9556+8F7, Kattoor, Kerala 680702, India",,Kerala
AL FOUZAN EXPORTS,"573R+R6P, Kunnukara, Kerala 683578, India",,Kerala
AL MUBARAK FACTORY AGENCY,"JHMC+MH7, Madappallly, Kerala 673103, India",,Kerala
AL-HASANATH GLOBAL,"I-289/A,M.S. Lane Adivaram, N.A.D.P.O, Aluva - 683 563, Edathala, Kerala 683563, India",,Kerala
ALAN EXPORTS,"7, Chowthri Nagar, Ramapuram, Chennai, Tamil Nadu 600087, India",Chennai,Tamil Nadu
ALCO ALUMINIUM PRODUCTS,"Chengannur, Kerala 689124, India",,Kerala
ALEENA FOODS,"XC62+3W9, Ambalamugal, Kochi, Kerala 682302, India",,Kerala
ALFINE MARKETING,"Sinai Kolara building:, Valanjavattom P.O,Alumthurathi via, Thiruvalla,kerala, Thiruvalla, Alumthuruthy, Kerala 689104, India",,Kerala
AMALGAM FROZEN FOODS,"V7PX+W8H, Aroor - Thoppumpady Rd, Aroor gram panchayat, Kochi, Kerala 688534, India",,Kerala
AMNA FOOD INDUSTRIES P.LTD.,"15/696, Near Sathrapadi Water Tank, Kanjikode Post, Palakkad, Pudussery Central, Kerala 678621, India",,Kerala
ANBU EXPORTS,"No 73, Nethaji Main Rd, Mullai Nagar, Poonthamalli Nagar, Meenambalpuram, Madurai, Tamil Nadu 625002, India",,Tamil Nadu
ANNAPOORNESWARI EXIM P.LTD.,"Erakari Road Vayalar 7/528 A KALYANI, Vayalar, Kerala 688524, India",,Kerala
ANPHARMA EQUIPMENTS,"Near Apollo Tyres, Perambra, Post, Dhanya Nagar, Chalakudy, Perambra, Kerala 680689, India",,Kerala
APT GLOBAL MARINE ENGINEERING,"X78R+4XF, S Over Bridge, Ernakulam South, Kochi, Kerala 682016, India",,Kerala
ARIHANT ASSOCIATES,"66A & 56, 1, Panchali Amman Koil Street, above Mahalakshmi Medicals, Koluthuvanchery, Jai Nagar, Arumbakkam, Chennai, Tamil Nadu 600106, India",,Tamil Nadu
ARUNA ALLOY STEELS P.LTD.,"No 3, 1, Melur Main Rd, Mellur, Anna Nagar, Sathamangalam, K.Pudur, Tamil Nadu 625107, India",,Tamil Nadu
ARVIN KNIT WEAR,"9a-l R G Lay Out, 5th Street, Karuvam Palyam, Karuvam Palyam, KPN Colony, Valipalayam, Tiruppur, Tamil Nadu 641604, India",,Tamil Nadu
ASHA RUBBER PRODUCTS PVT. LTD.,"Manikanda Puram, Thirumullaivoyal, Chennai, Tamil Nadu 600062, India",,Tamil Nadu
AYVA APPARELS P.LTD.,"3W3W+3H4, Koundampalayam, Coimbatore, Tamil Nadu 641029, India",,Tamil Nadu
BEETEX INDUSTRIES,"804, VKK Menon Rd, Opposite Srivani apartment, Siddhapudur, New Siddhapudur, Coimbatore, Tamil Nadu 641044, India",,Tamil Nadu
BENNYS BIO COIR,"1-799 vanjiyapuram Zamin kottampatty road, suleeswaranpatty p.o, Pollachi, VanjiyaPuram, Tamil Nadu 642006, India",,Tamil Nadu
BETA POWER CONTROLS,"No. 4/305, Othakalmandapam, road, Bodipalayam, Coimbatore, Tamil Nadu 641105, India",,Tamil Nadu
BLUE STAR COFFEE CURING WORKS,"6/423 A,B Malankara Post Nenmeni Malankara post, Sultan Bathery, Nenmeni, Koliyadi, Kerala 673592, India",,Kerala
CALEX MARINE&INDUSTRIAL,"2nd Floor, Chirayath Building, Opp KUFOS UG Ladies Hostel, Vytila Aroor Bye Pass Road, Service Road West, NH 47, NH 66, Madavana, Panangad, Ernakulam, Kochi, Kerala 682506, India",,Kerala
CALICUT CARGO SERVICES,"Calicut Airport Rd, Padinharathara, Karipur, Kerala 673647, India",,Kerala
CAPITAL PLYBOARDS,"3FW2+WGG, Ponjassery, Kerala 683547, India",,Kerala
CHAITHANYA GRANITE&MARBLES,"Edappally, Kochi, Kerala 682024, India",,Kerala
CISHAN INTERNATIONAL,"Plot number 13, 260c, Vellanikkara, Madakkathara, Kerala 680651, India",,Kerala
CMP GARMENTS,"No 144, Avinashi - Tiruppur Rd, Thaneerpanthal, Anupparpalayam Pudur, Tiruppur, A.Thirumuruganpoondi, Tamil Nadu 641652, India",,Tamil Nadu
COASTAL SHIPPING LINKS INDIA P.LTD.,"Door No: G 2102, Jawaharlal Nehru International Stadium, Jawaharlal Nehru International Stadium, Kaloor, Kochi, Kerala 682017, India",,Kerala
COCHIN DENTAL EQUIPMENTS,"67/977, North Park St Vincent Road, Kacheripadi Ernakulam, North, North Kaloor, Kacheripady, Kochi, Kerala 682018, India",,Kerala
COIR DUST INC.,"PARSA'S, Building No 828A, PO, opp. Central Coir Research Institute, Kalavoor, Alappuzha, Kerala 688522, India",,Kerala
CORAL EXPORTS,"NETTIPADAM ROAD, X78P+RV9, Mahatma Gandhi Rd, Valanjambalam, Ernakulam, Kochi, Kerala 682016, India",,Kerala
CRYSTAL KNITTERS P.LTD.,"FJW8+W38, Punnam, Tamil Nadu 638312, India",,Tamil Nadu
CSM ANIMAL HUSBAN DRY&AGRI,"77/C-4, Vivekananda Nagar Rd, Arulmurugan Nagar, Podanur, Tamil Nadu 641023, India",,Tamil Nadu
DANAVARSHINI EXPORTS,"192/1, Uthukuli Rd, Velliyampalayam, Tiruppur, Agraharaperiapalayam, Tamil Nadu 641607, India",,Tamil Nadu
DENWUD EXIM  INDIA,"Pulluvazhi, 683541, XV/642, Thombra Road, Rayamangalam, Kerala 683547, India",,Kerala
DIVINE RUBBER PRODUCTS,"FFRV+436, Kurichy - Eara - Kavalam Rd, Eara, Kerala 686534, India",,Kerala
DRY AIR TECHNOLOGIUS,"2/46, West St, Silamalai, B. Meenakshipuram, Tamil Nadu 625528, India",,Tamil Nadu
DRY-AIR TECHNOLOGIES,"2/46, West St, Silamalai, B. Meenakshipuram, Tamil Nadu 625528, India",,Tamil Nadu
E.S.KNITWEAR,"3/17A,Andipalayam,Kanakkampalayam, PO, Perumanallur, Kanakkam Palayam Pirivu, Tamil Nadu 641666, India",,Tamil Nadu
EFFAR CREATIONS,"S.F.No. 381/2, Murugan Nagar Extension, Mangalam Rd, Poompuhar Nagar South, Murugan Nagar, Sulthanpettai, Tiruppur, Chennai, Tamil Nadu 641663, India",,Tamil Nadu
ELLEN INDUSTRIES,"551A, VK Rd, Peelamedu, Coimbatore, Tamil Nadu 641004, India",,Tamil Nadu
ENRICH EXPORTS,"29a/6, Jawahar Nagar 2nd Street, Sirupoolvapatti Main road, 15, Velampalayam, Tiruppur, A.Thirumuruganpoondi, Tamil Nadu 641652, India",,Tamil Nadu
ESSAR INC.,"178,Pudhu Colony, 15, Thilagar Nagar, Velampalayam, Tiruppur, A.Thirumuruganpoondi, Tamil Nadu 641652, India",,Tamil Nadu
FLUID CONTROL RESEARCH INSTITUTE,"QPVH+362, West, Kanjikode, Pudussery West, Kerala 678623, India",,Kerala
FOUSIA TIMBER INDUSTRIES,"M8PJ+6X8, Nedumbrakkad, Cherthala, Kerala 688524, India",,Kerala
GANGA MACHINES,"No.5/89-3, Thottasalai Street, Periya Moperipalayam, Sulur, Coimbatore, Tamil Nadu 641659, India",,Tamil Nadu
GLADSON EXPORTERS,"5/99, James Nagar St, Muttom, Tamil Nadu 629002, India",,Tamil Nadu
GLOBAL ORGANIC CLOTHING COMPANY,"Unnamed Road, Chinnakarai, Tiruppur, Murugampalayam, Tamil Nadu 641604, India",,Tamil Nadu
GLOBAL TEC ENGINEERING,"near Calicut University, 4VRM+RWV hajiyar valavu, Kozhikode, Thenhipalam, Kerala 673636, India",,Kerala
GURUDEV MARKETING,"No:40, Narayana Mudali Street, Sowcarpet, George Town, Chennai, Tamil Nadu 600079, India",,Tamil Nadu
HADI EXPORTS LLP,"Sundaram Finance Building, 44C7+7W5, Calicut Rd, Karuvambram, Manjeri, Kerala 676517, India",,Kerala
HALIM AGRO FOODS,"7Q3R+HXG, Mini Bypass Rd, Palayam, Kozhikode, Kerala 673004, India",,Kerala
HANANI RUBBERS,"I D Plot No.90, P.O, Poovanthuruthu, Kottayam, Kerala 686012, India",,Kerala
HARIYAS EXPORTS,"8/697-D, Vigneshwara Nagar East, K.P. Nagar, Pooluvapatti, PN Rd, Post, Tiruppur, Tamil Nadu 641603, India",,Tamil Nadu
HOPICON SURGICALS,"Thondayad, Ground Floor, Fortune Towers, NH 66, Service Road, near Starcare Hospital, Thondayad, Kozhikode, Kerala 673017, India",,Kerala
INDUS TRADE LINKS,"Br:XLI/3842,Carmel Buildings, Banerji Rd, Kacheripady, Kochi, Kerala 682018, India",,Kerala
J.K.MACHINARIES,"680014, Bypass Junction Road, Kuttanellur, Thrissur, Kerala 680014, India",,Kerala
J.K.SHASTIVEL COTTON,"JK Shastivel Cotton S.F No.44, D.No.8/162-A4 Amman Nagar, Neruperichal Village,, Thiyagipalanisamy Nagar, Pooluvapatti, Tiruppur, Tamil Nadu 641602, India",,Tamil Nadu
J.S. MATS&MATTINGS,"Kangayam Rd, Nallur, Tiruppur, Tamil Nadu 641606, India",Tiruppur,Tamil Nadu
JAI RAM CREATIONS,"283/1, Deivanaiammal Layout, Dharapuram Main Rd, Thillai Nagar, Velliangadu, Tiruppur, Tamil Nadu 641608, India",,Tamil Nadu
JANITOR EXIM,"JANITOR EXIM, Bund road, Arakkakadavu, Vennala, Kochi, Kakkanad, Kerala 682028, India",,Kerala
JBM KITCHEN AND INTERIORS,"Building No. 1/65 B, Near Ramantukara Highschool, Vaidyarangadi, Ramanatukara, Kozhikode, Kerala 673633, India",,Kerala
JEEVA GARMENTS,"8/4087-A,Ayyappa Nagar, Pooluvapatti (p.o), Poyampalayam, Tiruppur, Tamil Nadu 641603, India",,Tamil Nadu
JMJ EXPORTS,"4, 92-6A, Magazine Road, Ramapuram, Parangi Malai, Chennai, St.Thomas Mount, Tamil Nadu 600016, India",,Tamil Nadu
JOEL RUBBER INDUSTRIES,"Mini Industrial Estate, Mattoor, Kalady, Kerala 683574, India",,Kerala
K.C.COCONUT PRODUCTS,"Kc coconut products, Kumminiparamba, Padinharathara, Karipur, Kerala 673638, India",,Kerala
K.K.P FINE LINEN,"88, Salem - Namakkal Rd, S P Pudur, Kamaraj Nagar, Periyapatti, Namakkal, Tamil Nadu 637001, India",,Tamil Nadu
K.L.ABDUL SATHAR IMPEX P.LTD.,"Abdul Sathar. Timber. Plywoods Hardwares, K.L, near Makkany, South Bazar, Kannothchal, Kannur, Kerala 670002, India",,Kerala
K.M.OIL INDUSTRIES,"KM Oil Industries, Meenapatty, Karuvanchal, Meenpatty, Kerala 670571, India",,Kerala
K.R.S. TEXTILES,"82, Nyniappa St, Rattan Bazaar, Park Town, Chennai, Tamil Nadu 600003, India",,Tamil Nadu
K.V.M.EXPORT GARMENTS,"opposite G.H Hospital, MGR Nagar, Kallavi, Papparapatti, Tamil Nadu 635304, India",,Tamil Nadu
KAMDAR EXPORTS,"No-15,1st floor, E VK Sampath Rd, Sampath Salai, Vepery, Periyamet, Chennai, Tamil Nadu 600007, India",,Tamil Nadu
KARNIZ PACKS LLP,"Perinagala, P.O, Pallikkara, Kochi, Kerala 683565, India",,Kerala
KAT ENGINEERING,"Paliyam Rd, Koottukadu, Chendamangalam, Paliyam, Kerala 683521, India",,Kerala
KAUTAM KNITS,"Ammapalayam, Tiruppur, Avinashi, Tamil Nadu 641652, India",,Tamil Nadu
KAVITHA EXPORTS,"89/98, SIDCO Industrial Rd, Sidco Industrial Estate, Villivakkam, Chennai, Tamil Nadu 600049, India",,Tamil Nadu
KELDA FOODS P.LTD.,"Naduviledathu Building, Kumaramangalam P.O Para Junction, Thodupuzha - Oonukal Rd, Mylacompu, Thodupuzha, Kumaramangalam part, Kerala 685608, India",,Kerala
KERALA BAMBOO HOUSE,"North cliff, Kurakkanni Temple road, Varkala, Kerala 695141, India",,Kerala
KERALA PLANTATIONS,"Kerala, India",,Kerala
KERALA STATE INDSTL.ENTERPRISES,"Kerala, India",,Kerala
KHUSHI INTERGROUP,"Bus Stop, Thodaparambu, Pooppani Rd, Perumbavoor, Kerala 683543, India",,Kerala
KOLLENGODE AGRO MILLS P.LTD.,"vattekkad, Kollengode, Kerala 678506, India",,Kerala
KRISHNAVENI GARMENTS,"S.F.NO.547, Kurian Thottam, Annaipalayam,, College Road, Vivekananda Nagar, Kamatchepuram, Tiruppur, Tamil Nadu 641602, India",,Tamil Nadu
KUNNATH PAPER MILLS P.LTD.,"JQCR+R4X, Meenkara - Parackachella Rd, Muthalamada South, Kerala 678507, India",,Kerala
KUNNATHAN WOOD PRODUCTS,"Panichayam Rd, Odakkali, Kerala 683549, India",,Kerala
LAKSHMI CASHEW COMPANY,"WJ4C+CG6, Mangad, Kollam, Kerala 691019, India",,Kerala
LANDEX GREEN SOLUTIONS,"Building NO-41, 2371, Medical Centre Rd, Kochi, Chakkalakkal, Palarivattom, Ernakulam, Kochi, Kerala 682028, India",,Kerala
MADURA MERCERISERS INDIA P.LTD.,"Madurai, Tamil Nadu, India",,Tamil Nadu
MAJESTIC ASSOCIATES,"48, Railway Feeder Rd, Sivagami Puram, Virudhunagar, Tamil Nadu 626001, India",,Tamil Nadu
MATHA TRADERS,"Canal Rd, near ST.James Church, Chambakkara, Poonithura, Maradu, Kochi, Kerala 682038, India",,Kerala
MAYUR LINKS,"127/21 A, Thalingikadu Thottam, pichampalayam, pichamapalayam pudur, po, Shrinagar, Raja Nagar, Pitchampalayam Pudur, Tiruppur, Tamil Nadu 641603, India",,Tamil Nadu
METRO TRADING SYNDICATE,"VII/594, Jews St, Jew Town, Kappalandimukku, Mattancherry, Kochi, Kerala 682002, India",,Kerala
METRON SYSTEMS,"76GV+3WF, Puthenchira, Kerala 680682, India",,Kerala
MICRO KNIT APPARELS,"38JW+C84, Tiruppur - Palladam Rd, Karuppa Gaundanpalayam, Tiruppur, Tamil Nadu 641604, India",,Tamil Nadu
MR.CARE CENTRE P.LTD.,"Fort Road, City Centre Building, 2nd Floor, near Computer Education, Taliparamba, Kannur, Kerala 670001, India",,Kerala
N.M.TEXTILES,"Big Bazaar St, Koothanallur, Tamil Nadu 614101, India",,Tamil Nadu
N.N.K.MARINE EXPORTS,"GROUND FLOOR , NO : 12, 29, North St, ICF South Colony, V.P.Colony, Ayanavaram, Chennai, Tamil Nadu 600023, India",,Tamil Nadu
NIFTY APPARELS,"17/3, Padmini Garden West 4th Street, Tiruppur - Kangayam Rd, KNS Subramaniam Nagar, Tiruppur, Tamil Nadu 641604, India",,Tamil Nadu
NJG CREATION ,"6 chinna thottam, Kangayam Road, 3rd St, K N P Colony, Bavani Nagar, Tiruppur, Pudhukkadu, Tamil Nadu 641604, India",,Tamil Nadu
ORIAL IMARA P.LTD.,"Kalaranthiri-Palakutti Rd, Palakkutty, Koduvally, Kerala 673572, India",,Kerala
P.T.EXPORTS,"Plot #1, Kannadasan St, KG NTR Heritage, Sri Ganesh Nagar, Kolathur, Chennai, Tamil Nadu 600099, India",,Tamil Nadu
P.V.KNIT FASHION,"81, Kongu Main Rd, T.N.K Puram, Tiruppur, Tamil Nadu 641607, India",,Tamil Nadu
PALANI VIJAY COTTSPIN PVT LTD,"Palani, Tamil Nadu, India",,Tamil Nadu
PALIA BROTHERS,"No. 1/238, Pulpally - Sultan Bathery Hwy, Chethalayam, Kidanganad, Kerala 673592, India",,Kerala
PARISONS ROLLER FLOUR MILLS (P) LTD.,"CHUNGAM JUNCTION, West Hill, Kozhikode, Kerala 673005, India",,Kerala
PDS ORGANIC SPICES,"HXGC+P9V, Valanjanaganam, Kuttikkanam, Kerala 685531, India",,Kerala
PEECHANARI HANDICRAFTS,"Kozhikode, Kerala 673015, India",,Kerala
PEEJAY AGRO FOODS,"No. 65, W Nada, West Nada, Guruvayur, Kerala 680101, India",,Kerala
PHYSTRON HEALTHCARE TECHNOLOGIES,"Q4F9+2VV, Palladam Rd, Settikaalipalayam, Tamil Nadu 642202, India",,Tamil Nadu
PIPER INTERNATIONAL,"Shed number 44,SIDCO,,Mudhalipalayam, Harihganans East Colony, Tiruppur, Tamil Nadu 641606, India",,Tamil Nadu
POSEIDON FOOD CO.,"688/1, 2nd Floor, Kunjalu's Place, PT Usha Rd, Shenoys, Kochi, Kerala 682011, India",,Kerala
PRECORE SOLUTIONS,"N, Meethiyans Tower, 4/361, North Kalamassery, Kalamassery, Kochi, Kerala 683104, India",,Kerala
PREMIER ENGINEERING PRODUCTS,"Kyomtha Seminary Rd, Thrippunithura, Kochi, Kerala 682305, India",,Kerala
Q-EXPORTS,"1743/C, 56 Veedu Colony, Sivakasi, Tamil Nadu 626189, India",,Tamil Nadu
Q-RICH CREATIONS,"D.No.208/2,SF.No.201/2, Sirupooluvapatti Main Road 15 - Velampalayam Opp. Amman Kalyana Mandapam, Sirupooluvapatti, Tiruppur, Tamil Nadu 641603, India",,Tamil Nadu
RAINBOW OVERSEAS,"No.15 ,Sripuram 3rd, Street, Tiruneermalai Main Rd, Nagalkeni, Chromepet, Chennai, Tamil Nadu 600044, India",,Tamil Nadu
RAIQA EXPORTS,"MK Arcade, near Tirurangadi Oriental School, Tirurangadi, Kerala 676306, India",,Kerala
RAJA AGENCIES,"Q4Q2+XJF, Bypass Road, opp. Bharath Pertoleum, PSP Nagar, Madathur, Thoothukudi, Tamil Nadu 628008, India",,Tamil Nadu
RAJSHREE KNITS,"Pudur Privu, Tiruppur, Tamil Nadu 641605, India",,Tamil Nadu
RAMTIRTH ORGANICS,"MVRC+8CR, Palakkad - Pollachi Rd, Gopalapuram, Tamil Nadu 642005, India",,Tamil Nadu
REALKNIT FASHION,"38RR+P59, K V R Nagar, Karuvampalayam, Tiruppur, Tamil Nadu 641604, India",,Tamil Nadu
REIA FASHIONS,"Swarnapuri Avenue, Thilagar Nagar, Anupparpalayam Pudur, Tiruppur, A.Thirumuruganpoondi, Tamil Nadu 641652, India",,Tamil Nadu
REMMY SUSTRATES INDIA P.LTD.,"295/2A, Kattampatti PO, Jakkarpalayam, Via, Pollachi, Tamil Nadu 642202, India",,Tamil Nadu
RGR KNITWEAR,"58FW+38V, Anna Nagar, Tiruppur, Tamil Nadu 641603, India",,Tamil Nadu
RKV IMPEX,"# 1/20, SAKTHI NAGAR, PN Rd, Raja Nagar, Poyampalayam, Tiruppur, Tamil Nadu 641603, India",,Tamil Nadu
ROLEX OIL MILL,"Iringal, Kerala 673522, India",,Kerala
RRK ALLOYS,"50 & 51 Sri, Subha Ganesh Industrial Estate, Post, Kuppepalayam, Tamil Nadu 641107, India",,Tamil Nadu
S.E.EXPORTS,"S.F No : 517, S.S.Nagr, 1st St, Thirumurugan Nagar, Tiruppur, Tamil Nadu 641607, India",,Tamil Nadu
SACS FOODS,"146 B/2 Puliyampatti, New Dharapuram Rd, Palani, Kodaimangalam, Tamil Nadu 624617, India",,Tamil Nadu
SAMYS INTERNATIONAL,"No. 5/77 Avinashi, Velampalayam, A.Thirumuruganpoondi, Tamil Nadu 641654, India",,Tamil Nadu
SAN PRECISION ALLOYS,"53, SIDCO Private Industrial Estate, Kurichi, Coimbatore, Tamil Nadu 641021, India",,Tamil Nadu
SANTHALAKSHMI MILLS P.LTD.,"JXXJ+MP8, Zamin Uthukuli, Tamil Nadu 642004, India",,Tamil Nadu
SANTHIGIRI KOOTTUKUDUMB COIR,"Ettumanoor, Kerala 686631, India",,Kerala
SIVAM ENTERPRISES & EXPORTERS,"26V3+5RC, PV Rajamannar Salai, Kannigapuram, Sector 3, K. K. Nagar, Chennai, Tamil Nadu 600083, India",,Tamil Nadu
SNEHA FABS,"16, Town Extension, 1st, Dharaprm Road, Dharaprm Road, KPN Colony, Valipalayam, Tiruppur, Tamil Nadu 641604, India",,Tamil Nadu
SPB METAL CASTERS,"10/3,PART,DVP INDUSTRIAL ESTATE, Athipalayam Rd, Ramakrishnapuram, Chinnavedampatti, Coimbatore, Tamil Nadu 641006, India",,Tamil Nadu
