Exporter Name,Address,District,State
ADHI A EXPORTS,"50-c/1, (west),, 4th Cross Rd, Thiru Nagar, Kamarajapuram, Karur, Tamil Nadu 639002, India",,Tamil Nadu
ADS APPARELS,"101, Rajdhani Towers, Workshop St, Sirupooluvapatti, Khaderpet, Rayapuram, Tiruppur, Tamil Nadu 641 60, India",,Tamil Nadu
ADSO NATURALS,"ADSO NATURALS Pvt.Ltd. SDF III, Kinfra Park, Kinfra Koratty Industrial Area Phase I, Koratty, Kerala 680309, India",,Kerala
AGATHYAN EXPORTS,"5748+39M, Velayudampalayam, Avinashi, Tamil Nadu 641663, India",,Tamil Nadu
AGRO COIR EXPORTS,"Sf.no.103,jallipatti village, Pollachi, Jallipatti, Tamil Nadu 642104, India",,Tamil Nadu
AGROPINE FOOD PROCESSORS,"Pezhakkappilly, Kerala 686674, India",,Kerala
AGTHYAN EXPORTS,"5748+39M, Velayudampalayam, Avinashi, Tamil Nadu 641663, India",,Tamil Nadu
ALCHEMY ALLOYS ,"Survey No.233/1-3, 233/1-4, 233/2 Industrial Development plot, Muttom, Thodupuzha, Muttom, Kerala 685587, India",,Kerala
ALCOT FABRICS,"9/476, Chinnandan Kovil Road, Sakthi Nagar (New), Karur, Tamil Nadu 639001, India",,Tamil Nadu
ALIMA TIMBER INDUSTRIES,"Old Muvattupuzha Rd, Perumbavoor, Kerala 683542, India",,Kerala
ALTERSOFT INNOVATIONS INDIA P.LTD.,"Second Floor, Valiyaveetil Buildings, NH 544 (Old NH, 47, Kochi - Salem Hwy, Edappally Toll, Nethaji Nagar, Edappally, Ernakulam, Kochi, Kerala 682024, India",,Kerala
AMAL PLYWOOD,"35/2229/B, Vazhi, B1, Palli Pradakshina Rd, Pallinada, Palarivattom, Kochi, Kerala 682025, India",,Kerala
AMARAVATHI TEXTILES,"9d, 3, 50th Feet Rd, Ramkrishnapuram, Karur, Tamil Nadu 639001, India",,Tamil Nadu
AMBITN LIFESCIENCES,"386X+V58, HMT Colony Rd, HMT Colony, North Kalamassery, Kalamassery, Ernakulam, Kochi, Kerala 683503, India",,Kerala
AMENSCO MEDICAL TECHNOLOGIES,"KINFRA Road, Nellad, Mazhuvannoor, Kerala 686669, India",,Kerala
AMERICAN ENGINEERING CONSULTANCY,"Pannikottu Building Opposite Government VHS School Thiruvalla, Puramattom panchayath, Puramattam, Kerala 689543, India",,Kerala
AMUR PHARMA EQUIPMENTS,"VDL Plaza, Paravattani East fort P.O, Priyadarsini Nagar, Paravattani, Thrissur, Kerala 680005, India",,Kerala
ANIRITHANYA TEX,"31/5, PILLAYAR KOVIL STREET, Uthukuli Rd, Kuthuspuram, Palayakadu, Tiruppur, Tamil Nadu 641601, India",,Tamil Nadu
ARAFATH HOSIERY GARMENTS,"34/97, 1st St, Rayapuram Extension, Rayapuram, Tiruppur, Tamil Nadu 641601, India",,Tamil Nadu
ARASAN IMPEX,"66, Chairman A R Arunachalam Rd, Sengamala Nachiar Puram, Sivakasi, Tamil Nadu 626123, India",,Tamil Nadu
ARIHANT TECHNOCAST,"Senniveerampalayam, Tamil Nadu 641107, India",,Tamil Nadu
AROPARK CREATIONS,"369, Tiruppur - Palladam Rd, Town Extn, Thottam, Tiruppur, Tamil Nadu 641604, India",,Tamil Nadu
ARUNAV KNITS,"57VQ+5XW, NH544, Avinashi, Tamil Nadu 641654, India",,Tamil Nadu
ASSA EQUIPMENTS,"No: 5/ 889 - C Pullamadai Vadakkalur, Annur, Tamil Nadu 641653, India",,Tamil Nadu
ATLAS GARMENTS,"Kunnangal pirivi, 28XF+QR8, Road, Arulpuram, Tiruppur, Tamil Nadu 641604, India",,Tamil Nadu
AUTO DIECASTING CO.,"SF 440, Athipalayam Rd, Ganapathy Housing Unit, Athipalayam Pirivu, Venkatasamy Nagar, Ganapathy, Coimbatore, Tamil Nadu 641006, India",,Tamil Nadu
AUTOGRADE INDUSTRIES,"6/49 - A2, Thrikkakara, Mundampalam, Kochi, Kakkanad, Kerala 682021, India",,Kerala
AUTOTEX P.LTD.,"13/20, Sitra, Kalapatti Main Rd, Nehru Nagar West, Coimbatore, Tamil Nadu 641014, India",,Tamil Nadu
BEST ASIAN TECHNOLOGIES,"Chinniyampalayam Industrial Estate, Chinniyampalayam, Coimbatore, Tamil Nadu 641062, India",,Tamil Nadu
BHARAT PLYWOOD & TIMBER,"17, Devangapet Street Number 3, Backside to, Sukrawar Pettai, R.S. Puram, Coimbatore, Tamil Nadu 641001, India",,Tamil Nadu
BIO SYS IMAGINE SOLUTONS,"2nd Floor, Nadha Complex, 18/1018/D2A, ZC N Rd, Palayam, Kozhikode, Kerala 673002, India",,Kerala
BIRLI KNITTERS,"S.F.355, B1A, Dharapuram Main Rd, Kovilvazhi, Tiruppur, Tamil Nadu 641608, India",,Tamil Nadu
BONAFIDE SURGICALS,"X7JP+6FP, Adv Easwara Iyer Rd, Shenoys, Kochi, Kerala 682018, India",,Kerala
BOSON PACKAGING,"18, Abirami Nagar, Sivaram Nagar, Kuniyamuthur, Coimbatore, Tamil Nadu 641008, India",,Tamil Nadu
C.B.TEX,"No. 2/858-1, Sakthi Nagar, 4th Cross Rd, Vadivel Nagar, Karur, Tamil Nadu 639002, India",,Tamil Nadu
CANNANORE TEX-STYLE INT'L.,"Kannur, Kerala, India",,Kerala
CANTY GARMENTS,"S.F No.577, behind Ramakrishna School, Radhakrishnan Nagar, Ammapalayam, Tiruppur, A.Thirumuruganpoondi, Tamil Nadu 641652, India",,Tamil Nadu
CATLYST CHEMICAL INDUSTRIES,"MASHREQ TRADE CENTRE CALICUT ROAD, Perintalmanna, Kerala 679322, India",,Kerala
CEE DEE GARMENTS,"36, Kaliyappa Nagar, 1st Street, Kangayam Rd, Cheran Nagar, Valliammai Nagar, Tiruppur, Tamil Nadu 641604, India",,Tamil Nadu
CENTROID POLYMER TECHNOLOGIES P.LTD.,"p-32(4),pearl road,KINFRA textile park, Kanjikode, Pudussery East, Kerala 678621, India",,Kerala
CK HOSEIREIS,"38QP+GQH, Karuvampalayam, Tiruppur, Tamil Nadu 641604, India",,Tamil Nadu
COCHIN PLYWOOD,"4F5M+JG5, Perumbavoor, Kerala 683542, India",,Kerala
COCHIN RESIDENCY P.LTD.,"Peeliyadu Road, near Amrita Hospital, Amrita Nagar, Edappally, Kochi, Kerala 682041, India",,Kerala
COIMBATORE COTS & COATINGS LTD.,"Coimbatore, Tamil Nadu, India",,Tamil Nadu
COIMBATORE POLYTEX,"Coimbatore, Tamil Nadu, India",,Tamil Nadu
COMPASS TEX,"Near Post, 461, 3rd Cross St, EB Colony, Abirami Nagar, Gandhinagar, Velampalayam, Tiruppur, Tamil Nadu 641603, India",,Tamil Nadu
CORNIER P.LTD.,"Vrindavan Tower, 10/485-G, West Kadungalloor, Aluva, Kerala 683110, India",,Kerala
COSMOS PACKAGING INTERNATIONAL,"EP 3/60, Thadicadu, Anchal, Arackal, Kerala 691306, India",,Kerala
COSSMO TEX,"3979+FQ9, K Chettipalayam, Tiruppur, Tamil Nadu 641605, India",,Tamil Nadu
COTTON PARK CLOTHINGS,"10/297D, ulageshwara nagar,Chennimalaipalayam, Ganapathipalayam Rd, Nochipalayam, Veerapandi, Tiruppur, Tamil Nadu 641605, India",,Tamil Nadu
D.V. DEO & SONS,"PLOT NO 9 MAJOR, Industrial Estate, South Kalamassery, Kalamassery, Kochi, Kerala 683109, India",,Kerala
DELCO ENGINEERING WORKS,"V7MQ+CV6, Joras (Market) Rd, North Kumbalangi, Kumbalangi, Kochi, Kerala 682007, India",,Kerala
DIPIN FABRICS,"W88J+FV8, Kottarathum Para, Azhikode, Azhikode South, Kerala 670009, India",,Kerala
DOITIER ENGINEERING EXPORTS,"3W36+4RJ, Vijayakumar Layout Main Rd, KNG Pudur Pirivu, Coimbatore, Tamil Nadu 641041, India",,Tamil Nadu
DRISHYA ENGINEERING,"KOLLPPALLY, KALAVAMKODAM P O CHERTHALA, ALAPPUZHA DIST, Kerala 688524, India",,Kerala
DUA NUT FOODS,"Malayalam nagar TKMC, PO, Vadakkanazhikam, Karicode, Peroor, Kollam, Kerala 691005, India",,Kerala
EAST COAST SPICES,"11/138, AB-10, Satellite Twp, Padamughal, Kakkanad, Kochi, Kakkanad, Kerala 682030, India",,Kerala
ECO STICKS,"Kinfra Textile Centre, Plot F 19, Taliparamba, Koovery, Kerala 670142, India",,Kerala
EINSTEK-ENGINEERING INSULATION,"Metro Pillar 450, PO Bus Stop, 2nd Floor, National Residency Complex, Bank Jn, Bank Junction, Mamangalam, Edappally, Ernakulam, Kochi, Kerala 682024, India",,Kerala
EKKI PUMPS,"1391, Sathy Rd, Sri Lakshmi Nagar, Ganapathy, Coimbatore, Tamil Nadu 641006, India",,Tamil Nadu
ELR EXPORTS INDIA,"CHIL SEZ IT Park, Saravanampatti, Coimbatore, Tamil Nadu 641035, India",,Tamil Nadu
ENPE  INDUSTRIES,"5/201, Namakkal Main Rd, Kumaramangalam, Tamil Nadu 637205, India",,Tamil Nadu
ESS ENN EXPORTS,"New Ramakrishanan Puram, N 0 5 B, 2nd Railway Crossing, Muthu Nagar, Renganatha Puram, Tiruppur, Tamil Nadu 641607, India",,Tamil Nadu
ESSTEE EXPORTS,"8/131, P.G..V Garden, Pooluvapatti(P.o), P.N. Road, Tirupur - 641602. INDIA., Tel: +91 421 3983600 / 2487111 FAX: +91 421 3983678, E-Mail: esstee@essteeexports.com, Mummoorthi Nagar, Tiruppur, Tamil Nadu 641602, India",,Tamil Nadu
EURO APPARELS ,"48CJ+C42, Kumar Nagar, Tiruppur, Tamil Nadu 641603, India",,Tamil Nadu
EUROAQUA PLUMTEK PVT LTD,"EDAPPADI, KUPPANOOR-POST, MAIN ROAD, Sankari, Tamil Nadu 637301, India",,Tamil Nadu
EXACTO TECHNOLOGY,"MM Sons Campus, 295, Sowri Palayam, Coimbatore, Tamil Nadu 641028, India",Coimbatore,Tamil Nadu
EXCEL KNIT EXPORTST,"No. 250, Sri Kanachi Kamatchi Nagar Kangayampalayam, Pudur Rd, Amarjothi Garden, Bavani Nagar, Tiruppur, Tamil Nadu 641604, India",,Tamil Nadu
EXPOKNITS INTERNATIONAL,"65, Mahavishnu Nagar, Angeripalayam, Tiruppur, Tamil Nadu 641603, India",,Tamil Nadu
F.Q.KNITS,"62, Mangalam Rd, Naranapuram, Tamil Nadu 641664, India",,Tamil Nadu
FLAV NATURA,"1/414, 1st Floor,Aynikkadan, Building, Railway Gate - Muringoor Link Rd, Muringoor, Chalakudy, Muringur Vadakkummuri, Kerala 680309, India",,Kerala
FLAVCO FOOD PRODUCTS INDIA P.LTD.,"P.O, Plot No: 39, Kinfra Mega Food Park, Kanjikode - Menonpara Rd, Kozhippara, Pudussery East, Kerala 678557, India",,Kerala
FORA TRADING CORPORATION,"65VP+3X9, Kothaparambu, Kodungallur, Kerala 680668, India",,Kerala
FRUCTUS INC.,"No. 6/858-M, 2nd Floor, Suite No. 552, Valamkottil Towers, Judgemukku, Thrikkakara, Kakkanad, Kochi, Kerala 682021, India",,Kerala
GALUKU EXPORTS (INDIA)PRIVATE LIMITED.,"Periyar Nagar, Vellalapalayam, 640120, Pollachi, Tamil Nadu 642120, India",,Tamil Nadu
GANAPATHY AGENCIES,"Old No. 45, Jani Jhan Khan Rd, Bharathi Salai, Triplicane, Chennai, Tamil Nadu 600014, India",,Tamil Nadu
GEECO ENERCON P.LTD.,"D/C-6, SIDCO Industrial Estate, Thuvakudi, Tamil Nadu 620015, India",,Tamil Nadu
GEETHALAYA EXPORTS,"No 29-A, PN Rd, Postal Colony, M G R Nagar, Weavers Colony, Tiruppur, Tamil Nadu 641602, India",,Tamil Nadu
GENIQXIS TECHNOLOGIES LLP,"61A, Daniel Nagar, Thoppampatti Pirivu, Venkadasalapathy Nagar, Villankurichi, Coimbatore, Tamil Nadu 641035, India",,Tamil Nadu
GLENMARGON INTERNATIONAL,"No 251, RJ Building, 1st Floor, MS Nagar,, Kongu main Road, Muruganathanapuram, Tiruppur, Tamil Nadu 641607, India",,Tamil Nadu
GOKULAM GARMENTS,"2/10b Kollukkadu, Palladam Road, Mangalam, Mangalam, Tiruppur, Mangalam, Tamil Nadu 641604, India",,Tamil Nadu
GOOD KNIT EXPORTS,"388J+5G2, Chinnakarai, Murugampalayam, Tamil Nadu 641604, India",,Tamil Nadu
GRAB GREEN ECO PRODUCTS,"4796+C34, Vanjipalayam, Avinashi, Tamil Nadu 641663, India",,Tamil Nadu
GREEN GROW COIR PLANT,"231/2B KOOLANAICKENPATTI PANAMARATHUPALAYAM VILLAGE, LACHUMAPURAM BO, GOMANGALAM, POST, Pollachi, Tamil Nadu 642107, India",,Tamil Nadu
GREEN INDIA TEXTILES,"254/2,Kasikattu Thootam, Swarnapuri Avenue, Koolipalayam Ring Rd, opp. Amarajothi Garden, EB Colony, Sirupooluvapatti, Tiruppur, Tamil Nadu 641652, India",,Tamil Nadu
GREEN MALABAR TRADING,"V/388C PIPELINE JUNCTION EDAPALLY, Edappally - Pukkattupady Rd, Thrikkakara, PO, Kochi, Kerala 682021, India",,Kerala
GREENKERA,"8/253A, MNF BUILDING , KAPPUMTHALA P.O, Muttuchira, Kerala 686613, India",,Kerala
GREENS AYURVEDA,"Greens Ayurveda Road, Azhiyur, Kerala 673310, India",,Kerala
GREENS FOOD PRODUCTS,"Chitra Tower, St Thomas St, above Confident Clinic, near St. Joseph's church, Nehru Nagar, Kuriachira, Thrissur, Kerala 680006, India",,Kerala
GURUDEV APPARELS,"No 2, PN Rd, Raja Nagar, Pitchampalayam Pudur, Tiruppur, Tamil Nadu 641666, India",,Tamil Nadu
HAIMA POLYMERS P.LTD.,"2FVR+QR2, Rubber Park Rd, Airapuram, Kerala 683556, India",,Kerala
HI SAFE RUBBERS,"4/87 A, Kallukadai Piriu, Siruvani Main Rd, Kalampalayam, Coimbatore, Tamil Nadu 641010, India",,Tamil Nadu
HI TECH ASSAY SUPPLIERS,"229-B/9/296, VELLAKALPATTY POST OMALUR TALUK, SALEM – 636 012, Kamaraj Nagar, Omalur, Tamil Nadu 636012, India",,Tamil Nadu
HI TECH JERSEYS,"2/365-C, Kulathupalayam Pirivu, S.Periyapalayam Post, Uthukuli Rd, Tiruppur, Kulathupalayam, Tamil Nadu 641607, India",,Tamil Nadu
HIMEX INTERNATIONAL,"No.1/528-1,SP Nagar South, Andankoil East, Karur, Tamil Nadu Pincode-639008, India",,Tamil Nadu
HRM TEXTILES,"266W+FX3, Kodangipalayam, Tamil Nadu 641662, India",,Tamil Nadu
IBIS MEDICAL EQUIPMENT,"45/279, Koothapady Road, Anjumuri, Thammanam, Anjumuri, Kuthappady, Thammanam, Kochi, Kerala 682032, India",,Kerala
INMO IMPEX,"Thirumittacode, Pattambi, Kerala 679533, India",,Kerala
INTEGRAL COCONUT PRODUCTS,"GPPH+VVF, Po, Kalpathur, Koloroth, Pin, Kerala 673524, India",,Kerala
IRFAN AGRO FOODS,"Kothode, Kuzhalmannam, Thenkurissi, Kerala 678702, India",,Kerala
JAY TEX APPARELS,"39CH+V6H, K Chettipalayam, Tiruppur, Tamil Nadu 641605, India",,Tamil Nadu
JAYAVARMA TEXTILES P.LTD.,"Regd Off: SF No.105, Sakthi Nagar (North, PN Rd, Raja Nagar, Poduvapatti Post, Tiruppur, Tamil Nadu 641602, India",,Tamil Nadu
JNF TRADING,"5GHP+429, Sankarankoil, Tamil Nadu 627756, India",,Tamil Nadu
JVP EQUIPMENTS,"S. F. No. 281/2, Nallathaneerthottam, Ganapathy Housing Unit, Ganapathy, Coimbatore, Tamil Nadu 641006, India",,Tamil Nadu
K.P.B. GLOBAL EXPORTERS PVT LTD,"48GC+GGX, Aluva - Paravoor Rd, Malikampeedika, Kerala 683511, India",,Kerala
K.V.SELVY TEX,"8/962, PN Rd, Karupparayan Nagar, Vengamedu, Mummoorthi Nagar, Tiruppur, Tamil Nadu 641603, India",,Tamil Nadu
KADS RESOURCES GARMENTS,"8/8, 1st St, kumaranandhapuram, Maruthachalapuram, Tiruppur, Tamil Nadu 641602, India",,Tamil Nadu
KAKKUZHIYIL TRADERS,"near Thinapuram, Rippon, Meppadi, Thinapuram, Kerala 673577, India",,Kerala
KALYANI INDO AGRO PRODUCTS,"B No 16, 663, Main Rd Alathur, Alathur, Kerala 678541, India",,Kerala
KANGAYAM COIR CLUSTER P.LTD.,"Kangayam, Tamil Nadu, India",,Tamil Nadu
KAY GEE INDUCTION SYSTEMS,"67/8, Athipalayam Rd, Lakshmi Thottam, Ramakrishnapuram, Ganapathy, Coimbatore, Tamil Nadu 641049, India",,Tamil Nadu
KELTRO EXPORTS,"Unnamed Road, Kulathupalayam, Tamil Nadu 638752, India",,Tamil Nadu
KERA;LA MATCH INDUSTRIES,"2MC7+CW9, Paingottoor, Kerala 686671, India",,Kerala
KERALA EXPORTS,"Kerala, India",,Kerala
KERALA STATE CO-OPERATIVE FEDERATION FOR FISHERIES,"Kerala, India",,Kerala
KNITFORT EXIMS,"Boyampalayam Rd, Karupparayan Nagar, Raja Nagar, Mummoorthi Nagar, Chettipalayam, Tiruppur, Tamil Nadu 641603, India",,Tamil Nadu
KRISBAL ENGINEERING P.LTD.,"SY.No.472/pt& 462/5 Prt Pudussery Central Village Block No.34, Building No. 13/9, Kanjikode, Pudussery Central, Kerala 678621, India",,Kerala
KUMARAN FILAMENTS P.;LTD.,"38, B3-1, Beach Rd, Erulapappuram, Nagercoil, Tamil Nadu 629002, India",,Tamil Nadu
L.S.AUTOMOTIVE INDIA P.LTD.,"Poonamallee High Rd, Perumalpattu, Tamil Nadu 600124, India",,Tamil Nadu
LOUISONS RUBBER PRODUCTS,"No5/621 Thadagam Main Road Below Union Bank, KNG Pudur pirivu, Kanuvai, Coimbatore, Tamil Nadu 641108, India",,Tamil Nadu
LOYAL KNIT WEAR,"139, 1-B, Tiruppur - Perumanallur Rd, Vengamedu, Mummoorthi Nagar, Tiruppur, Tamil Nadu 641602, India",,Tamil Nadu
LWIN EXPORTS,"382F+CXM, Tiruppur - Palladam Rd, Chinnakarai, Karaipudur, Tamil Nadu 641604, India",,Tamil Nadu
M.K.EXPORT TRADING COMPANY,"M K Export Trading Company 19 200 A Maraikal Kannara P O, Kerala 680652, India",,Kerala
M.S.EXPORTS,"32/38, Vinayagapuram Main Road, MMDA Colony, Arumbakkam, N Block, SIDCO Industrial Estate, MMDA Colony, Arumbakkam, Chennai, Tamil Nadu 600106, India",,Tamil Nadu
MAC AGRO TECH,"mac agro tech, Kavanur, Kerala 673639, India",,Kerala
MACURA MEDICAL SOLUTIONS,"285/F,Edathadan building, St. James Hospital Road, North, Chalakudy, Kerala 680307, India",,Kerala
MADATHIPARAMBIL OPTICALS,"Teejay Estate, Palarivattom Junction, Sonia Nagar, Palarivattom, Ernakulam, Kochi, Kerala 682025, India",,Kerala
MAHARANI AGRO PRODUCTS,"Kinalur, Kerala 673612, India",,Kerala
MAJESTIC  MACHINE WORKS,"25, P.N. Palayam Road, P.N. Palayam Road, Near Sree Hospital, Puliakulam, Puthiyavan Nagar, Sukrawar Pettai, R.S. Puram, Coimbatore, Tamil Nadu 641045, India",,Tamil Nadu
MALATHI ENGINEERING WORKS,"No: 33 & 34, SIDCO Indl.Estate, SIDCO Indl.Complex, Sipcot Jct Rd, Anthoni Pillai Nagar, Pappankuppam, Tamil Nadu 601201, India",,Tamil Nadu
MALLOW INTERNATIONAL,"SF, 535, Salem Bypass Rd, semmadai, Karur, Tamil Nadu 639006, India",,Tamil Nadu
MANGAL CREATIONS,"No: 141-a, th road, kaladipet, opp:, TVT Rd, Chinna Mettupalaiyam, Kaladipet, police station, Chennai, Tamil Nadu 600019, India",,Tamil Nadu
MANIGREEVA KNITTERS,"SITE NO : 57, DOOR NO : 1083-R, CHELLAM NAGAR PIRIVU WEST ANDIPALAYAM (PO, Mangalam Rd, Nvb Layout, Shivshakthi Nagar, Karuvampalayam, Tiruppur, Andipalayam, Tamil Nadu 641687, India",,Tamil Nadu
MAP KNIT EXPORTS,"No:57/1A3, Dhana's Industrial Complex, Kasipalayam Main Road, opposite Eswaran Kovil, Nallur, Tiruppur, Tamil Nadu 641606, India",,Tamil Nadu
MARINOS EXPORTS,"XII/240,Hemadri Building, Thirunalloor, P.O, Cherthala, Thirunallur, Kerala 688541, India",,Kerala
MARWOOD APPARELS,"Payyal, JN, Nedungapra, Vengoor, Kerala 683545, India",,Kerala
MAX TECH FLOW,"3273+G32, Poompogar Nagar, Vinayagapuram, Coimbatore, Tamil Nadu 641049, India",,Tamil Nadu
MED-X EQUI WORLD,"475, Jubilee Rd, Pilakool, Thalassery, Kerala 670101, India",,Kerala
MEDIGATE HEALTH CARE,"Hospital Road, Chakkarakkal, Kerala 670613, India",,Kerala
MERAKI LINKS,"67/5093, Door No. 17B, DD Oceano Mall, Marine Drive, Kochi, Kerala 682031, India",,Kerala
MERGE MECHANO P.LTD.,"446A, MERGE MECHANO COMPLEX KUMBALANGADU, KANJIRAKODE P O WADAKKANCHERY MUNCIPALITY, THRISSUR, Wadakkanchery, Kerala 680590, India",,Kerala
MODERN INDIA PRODUCTS,"314, Thiruvalluvar St, RJPM Avarampatti, Rajapalayam, Tamil Nadu 626117, India",,Tamil Nadu
MOHAN MILLS,"Mohanmills, No. 27, Gandhi Street, Thondamuthur Rd, Ajjanur, Sundappalayaam, Tamil Nadu 641007, India",,Tamil Nadu
MUTHU EXPORT HOUSE,"House 25, Muthu Export, New, Salem Bypass Rd, Karur, Tamil Nadu 639006, India",,Tamil Nadu
MYMI ENGINEERING SERVICES,"Ganapathy Colony Rd, 2th Street, Poomagal Nagar, Ekkatuthangal, Chennai, Tamil Nadu 600032, India",,Tamil Nadu
NIVETHA EXPORTERS,"4/3, Palladam Rd, LIG Colony, Mahalakshmi Nagar, Pollachi, Tamil Nadu 642002, India",,Tamil Nadu
NRP EXPORTS,"19/37, Periyar Street, Vengamedu, Karur, Tamil Nadu 639006, India",,Tamil Nadu
NXT INNOVATIONS,"Door No 16 / 138 1st Floor, Karappillil Building Opp Margin Free Market, Pallithazham Junction, PO, Pallithazham, Mulanthuruthy, Kerala 682314, India",,Kerala
OCEANO EXPORTS,"Happy Building, 616/2, Puthiyara Rd, Palayam, Kozhikode, Kerala 673004, India",,Kerala
OMKARA CREATIONS,"8, 719C, Vengamedu, Mummoorthi Nagar, Tiruppur, Tamil Nadu 641603, India",,Tamil Nadu
ORGANIC PERIYA,"V9P3+352, Manal, Kannur, Kerala 670014, India",,Kerala
PACCAI BAG FACTORY,"8C4Q+8QC, Ettamadai, Azhagiapandipuram, Tamil Nadu 629851, India",,Tamil Nadu
PARANTHAMAN EXPORTERS,"Plot M8, M9, Sipcot SEZ for Engineering Products, Perundurai, Tamil Nadu 638052, India",,Tamil Nadu
PERFECT ASSAY CUPELS,"1/25C, Vellakalpatty Village, Chettichavadi (PO), Omalur, TK, Vellakalpatti, Salem, Tamil Nadu 636012, India",,Tamil Nadu
PERFETTO NATURALS,"Anjannikunnu,Neervaram P O, Panamaram, Kerala 670721, India",,Kerala
PLANEX ASSOCIAES INDIA P.LTD.,"Perinchoor Rd, Pookkottumpadam, Amarambalam, Kerala 679332, India",,Kerala
PRAMOD IMPEX,"22, 4th Cross Rd, Kamarajapuram, Karur, Tamil Nadu 639002, India",,Tamil Nadu
PRANAO INTERNATIONAL,"Angeripalayam Main Rd, Pandian Nagar, Vengamedu, Poyampalayam, Chettipalayam, Tiruppur, Tamil Nadu 641603, India",,Tamil Nadu
PREMIER COIR PRODUCTS,"#61/4E, Kanjampatti road, Pollachi, Tamil Nadu 642003, India",,Tamil Nadu
PREMIUM FERRO ALLOYS LTD.,"Factory: Industrial Area, Binanipuram, Edayar, Binanipuram, Edayar, Aluva , Cochin, Kerala 683502, India",,Kerala
PRIME KNITS,"28JH+6MR, Ganapathipalayam, Tamil Nadu 641605, India",,Tamil Nadu
PRINTISIGN,"1st Floor, Golden Chamber, 5575/41, Kandam Kulam Rd, Markazudaawa, Palayam, Kozhikode, Kerala 673002, India",,Kerala
PRISTINE TROPICAL FRUITS AND AGRO PRODUCTS,"66RH+J3, Mampad, Kerala 676542, India",,Kerala
PRIYAN TEX,"123/1, Water office Rd, Vairapalayam, Erode, Tamil Nadu 638003, India",,Tamil Nadu
PROCON CONTROLS,"4/131, School Rd, Chellappa Goundan Puthur, Theethipalayam, Coimbatore, Tamil Nadu 641010, India",,Tamil Nadu
PULSE MEDI TECH,"35/1629, jubilee bazar, Kannur, Kerala 670001, India",,Kerala
QUE-RICO EXIM P.LTD.,"Vengoor, P.O., Perumbavoor, Kochi, Kerala 683546, India",,Kerala
QUEEN BEE VITALS,"658W+CPJ, Padakulam, Kodungallur, Kerala 680669, India",,Kerala
R.K.VETHA EXPORTS,"9A, Ramasamy Gounder lay-out,, 2nd Street, Uthukuli Rd, Nethaji Nagar, Karumarpalayam, Tiruppur, Tamil Nadu 641607, India",,Tamil Nadu
RADANS IMPEX,"20A, N Mada St, Vinayagar Kovil, Villivakkam, Chennai, Tamil Nadu 600049, India",,Tamil Nadu
RAK LABS LLP,"2/1-B-23 Orris Tower 3rd Floor Opp. HiLite Mall, NH, Mini Bypass Rd, Thondayad, Kozhikode, Kerala 673014, India",,Kerala
RAMANI IMPEX,"2/16-B, Cotton Mill Road, Rajaji Nagar, Muruganathanapuram, Tiruppur, Tamil Nadu 641602, India",,Tamil Nadu
RANK FORIGN TRADE,"No. 345, 3rd Floor, Fancy Complex, 7th St, Gandhipuram, Coimbatore, Tamil Nadu 641012, India",,Tamil Nadu
RASA EXPORTS,"Mahatma Gandhi Rd, Vaiyapuri Nagar, Green Lands, Karur, Tamil Nadu 639002, India",,Tamil Nadu
RATHNA IMPEX,"Sri, Ganesh Nagar St, Raja Nagar, Pitchampalayam Pudur, Tiruppur, Tamil Nadu 641603, India",,Tamil Nadu
RAYOS INC.,"26-D/40, Chinna Subbannan Street,K K Pudur, Saibaba Koil, Coimbatore, Tamil Nadu 641038, India",,Tamil Nadu
REGIN EXPORTS,"67PM+74X, Thickanamcode - Pookadai Rd, Nangachivilai, Thiruvithankodu, Tamil Nadu 629174, India",,Tamil Nadu
RMS INTERNATIONAL TRADING,"42g, 3, Railway Rd, Tenkasi, Tamil Nadu 627811, India",,Tamil Nadu
ROBERT EXPORTS,"No 2, Bagath Singh Street No 1,, Velandipalayam, Coimbatore, Tamil Nadu 641025, India",,Tamil Nadu
ROWLINE SOLUTIONS,"Karthala, thozhuvanoor P. O, Valanchery, Athavanad, Kerala 676552, India",,Kerala
S.K.COCO INTERNATIONAL,"3/254 C Pallipuram, P.O, Pin:688541, Cherthala, Pallipuram, Kerala 688541, India",,Kerala
S.P.YARN TEX,"3, 3rd, PN Rd, Kamaraj Nagar, Street, Tiruppur, Tamil Nadu 641602, India",,Tamil Nadu
S.V.KNITS,"28W7+2QP, Unnamed Road, Arulpuram, Tiruppur, Tamil Nadu 641604, India",,Tamil Nadu
SAGS APPARELS,"No. 8/1234R, M.L.R. Complex, 1st Floor, Mummorthi Nagar, PN Rd, Vengamedu, Poyampalayam, Tiruppur, Tamil Nadu 641602, India",,Tamil Nadu
SAI RAMADAN EXPORTERS,"Shop No.2, 678, Big Bazaar St, Town Hall, Coimbatore, Tamil Nadu 641001, India",,Tamil Nadu
SAKTIDHARA TEXTILES,"Thaneerpanthal, Anupparpalayam Pudur, Tiruppur, Avinashi, Tamil Nadu 641652, India",,Tamil Nadu
SAM CARBONS,"256, Varuthiangara Palayam, Suryanallur, Kundadam, Coimbatore, Tamil Nadu 638702, India",,Tamil Nadu
SANDFITS FOUNDRIES P.LTD.,"S.F.No. 200/1A, Trichy Road, Ravathur, Pirivu, Kannampalayam, Tamil Nadu 641402, India",,Tamil Nadu
SARAVANA TRADERS,"DP 115(sp)First floor, New Tiny Sector, Ambattur Industrial Estate, Ambattur, Chennai, Tamil Nadu 600058, India",,Tamil Nadu
SATTUR VENTATESHWARA PAPER,"Sattur, Tamil Nadu 626203, India",,Tamil Nadu
SEAWIND FISHERIES,"Choice Rd, near Choice company, Janatha Nagar, Palluruthy, Kochi, Kerala 682006, India",,Kerala
SENVAC EXTRACTION SYSTEM,"3W68+V23, Kanuvai, Coimbatore, Tamil Nadu 641041, India",,Tamil Nadu
SERVYOND IMPEX,"DOOR NO:VII / 151A KUMMINIPARAMBA PO Karipur, Kondotty, Karipur, Kerala 673638, India",,Kerala
SHARKS SAFETY) MADRAS)INC,"74, East Mada Church Store, Royapuram, Royapuram, Panaimarathotti, Pudumanaikuppam, Royapuram, Chennai, Tamil Nadu 600013, India",,Tamil Nadu
SHOBIKKA IMPEX,"2336+CF, Karur, Tamil Nadu 639006, India",,Tamil Nadu
SILIVER OIL MILLS,"Karuvarakundu-Perinthalmanna Road, Melattur, 37JV+732, Malappuram District, Edappatta, Kerala 679326, India",,Kerala
SISO COSMECTIC P.LTD.,"T.C.3/738-3, Siso Building, Chavadimukku, Sreekariyam, Thiruvananthapuram, Kerala 695017, India",,Kerala
SIYA RUBBERS,"HG3H+27F, Poovanthuruthu, Kerala 686012, India",,Kerala
SOCKS TEX,"2/12 therku thottam, Karuvampalayam, Tiruppur, Tamil Nadu 641604, India",,Tamil Nadu
SONAPET INDUSTRIES,"SF No. 223/3, Ittery Sandhu, 1A/50 Mattukara Samy Kovil Street, Sugunapuram (West), Arivoli Nagar (Via, Po, Vivekanandapuram, Kuniyamuthur, Coimbatore, Tamil Nadu 641008, India",,Tamil Nadu
SPICE MORE TRADING COMPANY,"Munnar Road, Valiyakandam Rd, Chelimada, Kumily, Attappallam, Kerala 685509, India",,Kerala
SREYEAS CREATIONS,"48C, K.V.P. Layout, Karuvampalayam, Tiruppur, Tamil Nadu 641604, India",,Tamil Nadu
SRI AKSHARA HITECH,"WXRJ+999, SIDCO Private Industrial Estate, Kurichi, Coimbatore, Tamil Nadu 641021, India",,Tamil Nadu
SRI JAYAPRABHA EXPORTS,"No. 24, Thiruvalluvar Nagar East, 2nd Street, North, Kongu Main Rd, T.N.K Puram, Tiruppur, Tamil Nadu 641607, India",,Tamil Nadu
SRI KRISH AUTOMATION,"S.F.No: 53, 1A, Athipalayam Rd, Chinnavedampatti, Coimbatore, Tamil Nadu 641049, India",,Tamil Nadu
SRI KVS INDUSTRIES,"NO,351, 600098, Sidco Industrial Estate, Ambattur, Chennai, Tamil Nadu 600098, India",,Tamil Nadu
SRI SELVA GARMENTS,"48MH+PF4, Gandhinagar Road, SBI Colony, Gandhinagar, Velampalayam, Tiruppur, Tamil Nadu 641603, India",,Tamil Nadu
ST.JUDE FOODS,"Anjilippa, Kanjirappally, Kerala 686518, India",,Kerala
STAARLIGHT EXPORTERS,"175 2A2, Koolipalayam Ring Rd, Vigneshwara Nagar, po, Tiruppur, Tamil Nadu 2, India",,Tamil Nadu
STAP APPARELS,"No. 3, Kurinchi Nagar Extn North, 2nd Street, Karunai Ammal Layout, Perichipalayam, Tiruppur, Tamil Nadu 641604, India",,Tamil Nadu
STAR ENGINEERING ENTERPRISES,"1/413, NGGO Colony Rd, Teachers Colony, Thudiyalur, Tamil Nadu 641022, India",,Tamil Nadu
STRETCH FASHIONS,"Nallur, Tiruppur, Tamil Nadu 641606, India",,Tamil Nadu
SUKI GARMENTS & FASHION WEAR,"No 1, Shenbanagar, Appachi Nagar Main Road, Postal Colony, Pitchampalayam Pudur, Tiruppur, Tamil Nadu 641602, India",,Tamil Nadu
SULOCHANA TEXTILE PROCESS,"SF NO:73, Thandalkaran Thottam, Po, Iduvampalayam, Vanjipalayam, Tiruppur, Tamil Nadu 641687, India",,Tamil Nadu
SULVER OIL MILLS,"Karuvarakundu-Perinthalmanna Road, Melattur, 37JV+732, Malappuram District, Edappatta, Kerala 679326, India",,Kerala
SUMIY APPARELS,"B No. 176/2A3, 176/2A4, 175/5A1, 175/5A2 Ground Floor, AG Pudur Road, Irugur, Tamil Nadu 641103, India",,Tamil Nadu
SUMMITS HYGRONICS PVT LTD,"SF 192, Airy Garden, Earithottam, Kannampalayam, Tamil Nadu 641402, India",Coimbatore,Tamil Nadu
SUPERBB TEX,"6, MGR NAGAR, 7TH STREET, PN Rd, behind Shanthi Theatre, MGR Nagar, Tiruppur, Tamil Nadu 641602, India",,Tamil Nadu
SURABHI INTERNATIONAL,"33, Officers Line, Anna Salai, Bishop David Nagar, Kosapet, Vellore, Tamil Nadu 632001, India",,Tamil Nadu
