Exporter Name,Address,District,State
SESHA EXPORTS,"8 3238 C, 8/3238B, 2nd St, Anna Nagar, Tiruppur, Tamil Nadu 641603, India",,Tamil Nadu
SEVANA PACKING,"Kizhakkambalam, Kochi, Kerala 680562, India",,Kerala
SEVEN HILLS FASHIONS,"59G2+C3F, Kaalampalayam, Tiruppur, Tamil Nadu 641666, India",,Tamil Nadu
SHA APPARELS,"37, 60 Feet Rd, Kumarnathapuram, Tiruppur, Tamil Nadu 641602, India",,Tamil Nadu
SHAJI MOULDS AND PRODUCTS,"275/D1, KURUMBAN THOTTAM, 11 TH STREET, Sanganoor Rd, Ganapathy, Coimbatore, Tamil Nadu 641006, India",,Tamil Nadu
SHAKTHI KNITTING P. LTD.,"3/606-C, Shakthi Centre Post, Nochipalayam Rd, Veerapandi, Tiruppur, Tamil Nadu 641605, India",,Tamil Nadu
SHAMA EXPORTS & IMPORTS,"KINFRA Parks, Menamkulam, Kazhakuttom, HV26+R53, Pallithura, Thiruvananthapuram, Kerala 695586, India",,Kerala
SHAMA EXPORTS P.LTD.,"KINFRA Parks, Menamkulam, Kazhakuttom, HV26+R53, Pallithura, Thiruvananthapuram, Kerala 695586, India",,Kerala
SHARAFIYA TRADING,"Eriyad, Porur, Kerala 679328, India",,Kerala
SHARO EXPORTS,"Door No. FC, Plot No: 50, Justice Rathinavel Pandian Rd, Golden George Nagar, Mogappair East, Chennai, Tamil Nadu 600050, India",,Tamil Nadu
SHARON INSUL INDIA LTD.,"Kakkanad, 7/838(B, Seaport - Airport Rd, Vidya Nagar Colony, Thrikkakara, Kochi, Kerala 682021, India",,Kerala
SHARP KNIT FASHIONS,"No 12, Netaji Nagar, Karumarampalayam Road, 2nd Street Extension, Karumarpalayam, Mannarai, Tiruppur, Tamil Nadu 641607, India",,Tamil Nadu
SHERATONE ANTIQARTS,"Door number VI, 26, Jew Town Rd, Jew Town, Kappalandimukku, Mattancherry, Kochi, Kerala 682002, India",,Kerala
SHERTALLAI COIR MATS & MATTING CO.,"Cherthala, Kerala, India",,Kerala
SHINY KNITWEAR,"24, Appachi Nagar Main Road, Appachi Nagar, Kongu Nagar, Tiruppur, Tamil Nadu 641607, India",,Tamil Nadu
SHREE A.R.S.KNITS,"Mahavishnu Nagar, Pitchampalayam Pudur, Tiruppur, Tamil Nadu 641603, India",,Tamil Nadu
SHRI SHAKTHI ASSOCIATES,"163/A, Thiruvenkatasamy Rd W, R.S. Puram, Coimbatore, Tamil Nadu 641002, India",,Tamil Nadu
SHRI SUBAM TEX,"SF No: 540/2, Ring Road, opp. Anbu Illam, Thirumurugan Poondi, A.Thirumuruganpoondi, Avinashi, Tamil Nadu 641652, India",,Tamil Nadu
SIEGER SPINTECH EQUIPMENTS P.LTD.,"SF No. 49 Annur Road,, Arasur Post,, Coimbatore, Tamil Nadu 641107, India",,Tamil Nadu
SILVER STAR SEAFOODS LTD.,"V834+2GJ, Chandiroor, Kerala 688535, India",,Kerala
SINICON CONTROLS P. LTD.,"Sinicon House"" , XVII/906, IDA, West, Kanjikode, Pudussery Central, Kerala 678623, India",,Kerala
SIPCO CURIO,"6/207, AB Salem Rd, Jew Town, Kappalandimukku, Mattancherry, Kochi, Kerala 682002, India",,Kerala
SIVA APPARELS,"49Q7+MJQ, Nallathupalayam, Tiruppur, Tamil Nadu 641666, India",,Tamil Nadu
SIVA EXPORTS,"14, South St, Anuppanadi, Madurai, Tamil Nadu 625009, India",,Tamil Nadu
SIVADAS TEXTILES,"FXCJ+788, Kaimanam, Pappanamcode, Thiruvananthapuram, Kerala 695018, India",,Kerala
SKL EXPORTS,"SF. No. 396/2E, 295/1C, Post, Mahavishnu Nagar, Angeripalayam, Tiruppur, Tamil Nadu 641603, India",,Tamil Nadu
SKYWALK EXPORTS,"71,PVG NAGAR, Samundipuram Main Rd, near HP Petrol Bunk, Valayankadu South, P V C Nagar, M.N.Sivasubramanian Nagar, Tiruppur, Tamil Nadu 641603, India",,Tamil Nadu
SMARTO PRODUCTS,"Perumanoor P.K.Road, Chacola Colony, Thevara, Kochi, Kerala 682015, India",,Kerala
SNEGAM EXPORTS,"39R6+RQW, Pudur Rd, MR Nagar, K N P Colony, Pudur Privu, Tiruppur, Tamil Nadu 641605, India",,Tamil Nadu
SONA EXPORTERS,"P2MW+H75, Changaramkulam, Kerala 679591, India",Chiyanoor,Kerala
SOND KNIT GARMENTS,"02, Thabadar Thottam, Bharathi Nagar, Bharathi Nagar, KPN Colony, Valipalayam, Tiruppur, Tamil Nadu 641652, India",,Tamil Nadu
SONEX METAL COMBINES,"69VC+WV9, Service Rd, Naipunnya Nagar, Pongam, Kizhakkummuri, Angamaly, Kerala 680308, India",,Kerala
SOUMYA PLASTICS,"Ollur Industrial Estate, Ollur, Thrissur, Kerala 680306, India",,Kerala
SOUPARNIKA EXPORT ENTERPRISES,"Decent Jun, Palathara, Kollam, Kerala 691577, India",,Kerala
SOUTH KERALA CASHEW EXPORTERS,"A-20, Mangadu Rd, Mangad, Kollam, Kerala 691015, India",,Kerala
SOUTHERN CARBON AND CHEMICALS,"Vyloppilly Ln, Azad Road, Kaloor, Ernakulam, Kerala 682017, Kathrikadavu, Kaloor, Ernakulam, Kochi, Kerala 682017, India",,Kerala
SOUTHERN CASHEW EXPORTERS,"WJFQ+R27, Kilikkollur, Chandanathope, Kottamkara, Kerala 691004, India",,Kerala
SOUTHERN COIR MILLS,"P.O. Cherthala, S.N.Puram, Cherthala, Kanjikkuzhi, Kerala 688582, India",,Kerala
SPECTRA ORGANICS,"1572, S Thamaraparambu Rd, Thamaraparambu, Fort Kochi, Kochi, Kerala 682001, India",,Kerala
"SREE GANAPATH GAR,MENTS","26-B President Thottam Thottipalayam Pirivu, Civil Aerodrome Post, Karuparampalayam Pirvu, Coimbatore, Tamil Nadu 641014, India",,Tamil Nadu
SREE SAKTHI PAPER MILLS,"X78M+P3P, Paliyam Rd, Pallimukku, Ernakulam, Kochi, Kerala 682016, India",,Kerala
SREE SANKARA AYURVEDA VAIDYASALA,"Mannam Rd, Changanassery, Kerala 686102, India",,Kerala
SREE VALSA ENGINEERING WORKS,"36, Nanda Nagar Road, Singalluar, Singalluar, Coimbatore, Tamil Nadu 641005, India",,Tamil Nadu
SREEKANDHA WEAVING WORKS,"W942+CJF, Chirakkal, Kerala 670009, India",,Kerala
SRI ANURAGAVI GARMENTS,"48QM+8X9, Unnamed Road, Mahavishnu Nagar, Pitchampalayam Pudur, Tiruppur, Tamil Nadu 641603, India",,Tamil Nadu
SRI GARMENTS,"95, A, 8, Angeripalayam Main Rd, Mahavishnu Nagar, Pitchampalayam Pudur, Tiruppur, Tamil Nadu 641603, India",,Tamil Nadu
SRI KUMARAN FABS,"97A1, AMMAPALAYAM PIRIVU, Mangalam Rd, Palladam, Tamil Nadu 641664, India",,Tamil Nadu
SRI MURUGAN FOUNDRY EQUIPMENT,"12/3, Luna Nagar, Abbas Garden,, India, Edayarpalayam, Coimbatore, Tamil Nadu 641025, India",,Tamil Nadu
SRI RAMA MODERN RICE MILL,"Keranur, Chinnasalem, Tamil Nadu 606201, India",,Tamil Nadu
SRI SARAVANAA FABS,"22XP+PHF, NGP Nagar, Nehru Nagar West, Coimbatore, Tamil Nadu 641014, India",,Tamil Nadu
SRI SRI CLOTHING,"56PW+C93, Sembianallur, Avinashi, Tamil Nadu 641654, India",,Tamil Nadu
SRI VAARI EXPORTS,"A.P 1702, 15th West Cross St, MKB Nagar, Mahakavi Bharathiyar Nagar West, Mahakavi Bharathi Nagar, Vyasarpadi, Chennai, Tamil Nadu 600039, India",,Tamil Nadu
SRISTI GARMENTS,"Ring Road Housing Sector, Madhavaram, Chennai, Tamil Nadu 600060, India",,Tamil Nadu
SSV EXPORTS,"First Floor Plot, 156, Madambakkam Main Rd, Maruthi Nagar, Madambakkam, Chennai, Tamil Nadu 600126, India",,Tamil Nadu
ST.GEORGE FOODS,"2PX7+7GC, Puthoor, Kerala 691507, India",,Kerala
ST.GREGORIOS CASHEW INDUSTRIES,"2PQ6+2JG, Thekkumpuram Puthoor PO Kottarakara, Puthoor, Kerala 691507, India",,Kerala
ST.JOSEPH'S PRESS,"415, Cotton Hill Rd, Cotton Hill, Vazhuthacaud, Thiruvananthapuram, Kerala 695014, India",,Kerala
ST.MARY'S CASHEW FACTORY,"St.Mary's Cashew Factory, Kottarakkara Sasthamcotta Rd, Puthoor, Kerala 691507, India",,Kerala
ST.MARYS RUBBERS P.LTD.,"2X3J+7GF, Kollam - Tenkasi Rd, Edamon Sathram, Edamon, Kerala 691307, India",,Kerala
ST.MIKHAEL CASHEW EXPORTS,"WP95+FRF, Nallila Rd, Puliyila, Kerala 691515, India",,Kerala
STANDARD CURLED COIR,"sf 254, main road ,kovilpalayam post, Mettupalayam, Kovilpalayam, Tamil Nadu 642110, India",,Tamil Nadu
STANES AMALGAMATED ESTATES LTD.,"C/o T.Stanes & Company Limited, 1625, Trichy Rd, Mamarath Thottom Ganapathy, Race Course, Coimbatore, Tamil Nadu 641018, India",,Tamil Nadu
STANFAB APPARELS,"14, East, Anna Nagar W Ext Rd, Mogappair Industrial Estate, Padi Pudur Nagar, Anna Nagar West, Mogappair East, Chennai, Tamil Nadu 600037, India",,Tamil Nadu
STARFISH EXPORTS,"Ancy Nagar, South Kollamcode, Pozhiyoor, Kerala 695513, India",,Kerala
STARLINE ENTERPRISES,"Krithika, Sri Sai Building, Industrial Est Rd, Seerapalayam, Tamil Nadu 641105, India",,Tamil Nadu
STOWA GARMENTS,"1/563-H srinivasa nagar kallangadu 1 st street, Velliangadu, Thennampalayam, Tiruppur, Tamil Nadu 641604, India",,Tamil Nadu
SUDAR APPARELS,"No 32, Dharapuram Main Rd, K Chettipalayam, Tiruppur, Tamil Nadu 641604, India",,Tamil Nadu
SUDHAMA HOSIERIES,"No-5, Sixty Feet Road, Asher Nagar, Tirupur - 641603, Avinashi - Tiruppur Rd, Asher Nagar, Tiruppur, Tamil Nadu 641603, India",,Tamil Nadu
SUITMAN GARMENTS,"383G+HXF, Kairali Nagar, South Kalamassery, HMT Kalamassery, Kochi, Kerala 682022, India",,Kerala
SUKAS PAPER PRODUCTS,"2, Mullurkara, Kerala 680590, India",,Kerala
SULOCHANA COTTON MILLS,"3WQQ+FG7, NH-67, NGGO Colony, Thudiyalur, Tamil Nadu 641022, India",,Tamil Nadu
SUMANGALI FABRICS,"RCVC+2G4, po, Thottada, Kerala 670007, India",,Kerala
SUN BIO NATURALS(I)P.LTD.,"Super A7, Thiru Vi Ka Industrial Estate, SIDCO Industrial Estate, Guindy, Chennai, Tamil Nadu 600032, India",,Tamil Nadu
SUNKO SPICES,"J527+X27, Unnamed Road, Anjur, Kerala 680601, India",,Kerala
SUNRICE TRADERS,"Pandit Karuppan Rd, Mattummal Junction, Mattummal, Thevara, Kochi, Kerala 682013, India",,Kerala
SUNRISE KNITTING MILLS,"D1 & D2, Nethaji Apparel Park, Eettiveerampalayam, New, Sirupooluvapatti, Khaderpet, Rayapuram, Tiruppur, Tamil Nadu 641666, India",,Tamil Nadu
SUPER COCO COMPANY,"J4FH+H6X, Kundalapatti Erisanampatti Rd, Kedimedu, Tamil Nadu 642107, India",,Tamil Nadu
SUPER SPINNING MILLS LTD.,"Elgi Towers, Green Fields, 737 D, Puliakulam Rd, Dhamu Nagar, Coimbatore, Tamil Nadu 641045, India",,Tamil Nadu
SUPERIOR MAT HOUSE,"5FF3+V99, Mekalady, Kalady, Kerala 683574, India",,Kerala
SUREKHA EXPORTS,"3rd Floor, Emerald Mall, Mavoor Rd, Arayidathupalam, Kozhikode, Kerala 673001, India",,Kerala
SWARAJ FASHIONS,"S.F.No.341, Thilagar Nagar west, Anupparpalayam,, 15.Velampalayam,, Velampalayam, Tiruppur, A.Thirumuruganpoondi, Tamil Nadu 641652, India",,Tamil Nadu
SWARNA KALEESWARA KNITTING,"26, Harvey Rd, PSS Colony, Sidco Industrial Estate, Tiruppur, Tamil Nadu 641602, India",,Tamil Nadu
SWATHIKA TEXTILE MILLS P.LTD.,"# 33/16 3 rd Street, Padmavathi Puram , Gandhi Nagar, Jain Nagar, Chromepet, Tirupur, Chennai, Tamil Nadu 641603, India",,Tamil Nadu
SYDA POLYLAMINATES,"3rd Floor, Syda Building,Kochi, Kaloor - Kadavanthara Rd, Kaloor, Ernakulam, Kochi, Kerala 682017, India",,Kerala
SYDNEY APPARELS,"Sirupooluvapatti, Tiruppur, Tamil Nadu 641687, India",,Tamil Nadu
SYMPHONY EXPORTS,"38WW+JFF, Kamatchi Amman, Tiruppur, Tamil Nadu 641604, India",,Tamil Nadu
SYNTHESIS HOME TEXTILES P.LTD.,"69 - 74, Salem Bypass Rd, SIDCO Industrial Estate, Karur, Tamil Nadu 639006, India",,Tamil Nadu
T.G.POLYMERS&COMPANY,"Aryakara, Muhamma, Kerala 688525, India",,Kerala
T.J.P. RUBBER INDUSTRIES,"Industrial Development Plot, PO, Poovanthuruthu, Kottayam, Kerala 686012, India",,Kerala
T.J.P.EXPORTS,"ID Plot, Poovanthuruthu, Kottayam, Kerala 686012, India",,Kerala
T.K.MACHINERIES,"Ollur, Thrissur, Kerala 680014, India",,Kerala
T.V.J MARKETING,"FIRST FLOOR, TVJ ESTATE, 1516E NHG LANE, LPS Rd, Ponnurunni, Vyttila, Kochi, Kerala 682019, India",,Kerala
TAG CHEMICALS INDIA PVT LTD.,"Kinfra Biotechnology And Industrial Zone, Medical College - NAD Road, HMT Colony, North Kalamassery, Kalamassery, Kalamassery, Kochi, Kochi, Kerala 683503, India",,Kerala
TAJ COIR MILLS,"Thalavady Rd, Thalavady, Aikyabharatham, Alappuzha, Aryad South, Kerala 688006, India",,Kerala
TAJ PLYWOODS,"3GHV+626, Methala, Rayamangalam, Kerala 683545, India",,Kerala
TALASH PLASTOPACKS,"Swaraj Plywood Road, Pappinisseri, Kerala 670561, India",,Kerala
TAMILNADU NEWSPRINT & PAPERS LTD.,"Tamil Nadu, India",,Tamil Nadu
TASTY NUT INDUSTRIES,"KP Road, WJ5C+95H, Kilikolloor, Mangad, Kollam, Kerala 691004, India",,Kerala
TAURUS RUBBER INDUSTRIES,"HG2G+QPW, Unnamed Road, Poovanthuruthu, Kerala 686012, India",,Kerala
TEA BREAK INTERNATIONAL,"X759+6R8, Willingdon Island, Kochi, Kerala 682003, India",,Kerala
TEAM SPORT CLOTHINGS,"Erukkadu Thottam, Nochipalayam Road, Veerapandi, 383W+WJ2, Veerapandi, Tiruppur, Tamil Nadu 641605, India",,Tamil Nadu
TECHNO EXPORTS,"Pattanakad, P.O, Cherthala, Pattanakkad, Kerala 688531, India",,Kerala
TECHNOFLEX RUBBER PRODUCTS,"59RJ+3WP, Unnamed Road, Angamaly, Kerala 683572, India",,Kerala
TECMO INDUSTRIES,"2, 200 Karayampalayam, GEM Nagar, Mylampatti, Tamil Nadu 641062, India",,Tamil Nadu
TEREX INDIA PVT.LTD,"E-18, Phase II, Sipcot Expansion II, Moranapalli, Sipcot Phase II Industrial Complex, Sipcot Ph 2, Hosur, Moranapalli, Tamil Nadu 635109, India",,Tamil Nadu
TEX INDIA APPARELS,"S.F.NO135/5 JEEVA NAGAR, Murugampalayam Rd, Kamachiamman Nagar, Iduvampalayam, Tiruppur, Murugampalayam, Tamil Nadu 641687, India",,Tamil Nadu
TEXCITY APPARELS,"post, S.F.403, Aathupalayam Main Rd, Anupparpalayam Pudur, Tiruppur, Tamil Nadu 641652, India",,Tamil Nadu
TEXCO APPARELS,"AVP Rd, Periyar Colony, Anupparpalayam Pudur, Tiruppur, Tamil Nadu 641652, India",,Tamil Nadu
THAHIRA CHEMICALS,"V7QW+9J8, Aroor gram panchayat, Kochi, Kerala 688534, India",,Kerala
THANGAMMAN FASHIONS,"No-5/3, Prabhu Nagar, Rakkiyapalayam Pirivu Kangayam Road, Nallur, S I D C O, S I D C O, Cheran Nagar, Valliammai Nagar, Tiruppur, Tamil Nadu 641606, India",,Tamil Nadu
THANKS GARMENTS,"2, Bridgeway Colony Extension, Main Road, Main Road, KPN Colony, Valipalayam, Tiruppur, Tamil Nadu 641607, India",,Tamil Nadu
THIASHOLA PLANTATIONS P.LTD.,"Thaishola, Tamil Nadu 643209, India",,Tamil Nadu
THREE STAR MARINE EXPORTS,"R8P3+PJM Aroor gram panchayat, Chandiroor, Kochi, Kerala 688534, India",,Kerala
TIMELESS TEXTILES TRADERS,"X11, Bld, 510, Poyyoor Road, Mayyil, Kerala 670602, India",,Kerala
TIRUPUR PANDIT HOSIERY MILLS,"S.F. No. 647-B, Cherangadu, K.N.P. Colony Post, Dharapuram Main Rd, Thillai Nagar, Tiruppur, Tamil Nadu 641608, India",,Tamil Nadu
TOM KNITTERS,"39M4+HW3, 60 Feet Rd, Gopal Nagar, Velliangadu, Tiruppur, Tamil Nadu 641605, India",,Tamil Nadu
TONY WOOD INDUSTRIES,"Kaviyoor, Kerala 689582, India",,Kerala
TRANQUIL CASTLES HOTELS & RESPORTS,"2nd Floor, Cherupushpam Building, Near ICICI Bank, Opp M. G. Road, Shipyard Quarters Road, Cheriyakadavanthra, Atlantis, Ravipuram, Panampilly Nagar, Kochi, Kerala 682015, India",,Kerala
TRAVANCORE COCOTUFT P.LTD.,"Coir Park, Thiruvizha North Road, Mayithara, Cherthala, Cherthala South, Kerala 688539, India",,Kerala
TRENDZ FURNITURE WORLD,"327G+XWF, Oorakam, Kerala 676519, India",,Kerala
TRIBHUVAN APPARELS PVT LTD,"454/1F1 AVINASHILINGAMPALAM ROAD, VILLAGE, Palangarai, Avinashilingampalayam, Avinashi, Tamil Nadu 641654, India",,Tamil Nadu
TUFCKO INTERNATI0NAL,"HQCR+3V5, Kanjirappally, Kerala 686507, India",,Kerala
TUSCANY KERALA GARMENTS P.LTD.,"Kerala, India",,Kerala
U.K. TEXTILES,"199(E), Sf-448, A B Nagar, Main Road, Sivakami Nagar, 15, Lakshmi Theatre Road, EB Colony, Velampalayam, Tiruppur, Tamil Nadu 641603, India",,Tamil Nadu
UNI GREEN CONDIMENTS,"WHHV+XV8, Neeravil, Kerala 691601, India",,Kerala
UNIGUL TRADERS,"TC 12/133 PUSHPA VIHAR, Plamoodu - Thekkamoodu Rd, Plamoodu Thekkumoodu Residents Association, Pattom, Thiruvananthapuram, Kerala 695004, India",,Kerala
UNIROYAL MARINE EXPORTS LTD.,"Vengalam, National Highway 17, Kunnathkara, Chemancheri, Kerala 673303, India",,Kerala
UNISOURCE TREND INDIA,"38RP+XC5, K V R Nagar, Karuvampalayam, Tiruppur, Tamil Nadu 641604, India",,Tamil Nadu
UNITED COIR FACTORIES,"A.S Road, Kommady, Alappuzha, Aryad South, Kerala 688007, India",,Kerala
UNITED NILGIRIS TEA ESTATE CO. LTD.,"Nilgiris, Tamil Nadu, India",,Tamil Nadu
UNIVERSAL OLEORESINS,"VIII/946 Navaratna House Jawahar Road, Pandikudi Rd, Pandikudy, Shanthi Nagar Housing Colony, Mattancherry, Kochi, Kerala 682002, India",,Kerala
USHA RUBBERS,"Plot No 64/C Athani Industrial Development Area Medical College Road, PO, SIDCO Peringandoor Industrial Area Phase I, Peringandoor, Kerala 680581, India",,Kerala
UVASHREE GARMENTS,"584G+WGX, Aathuppalayam, Tiruppur, Tamil Nadu 641652, India",,Tamil Nadu
V.M. OVERSEAS TRADING COMPANY,"DOOR NO III/53, BEHIND ALL SAINTS BUILDING OPP TO ITI KANJIKODE, Palakkad, Pudussery Central, Kerala 678623, India",,Kerala
V.R.FOUNDRIES,"83, 2nd St, Peelamedu, PKD Nagar, Coimbatore, Tamil Nadu 641004, India",,Tamil Nadu
V.V.S. AUTOMATIC DOORS,"VVS AUTOMATIC DOORS, Pethanaickenpalayam, 4/206/4, Pongalur, Avinashi, Tamil Nadu 638459, India",,Tamil Nadu
VAISHAK EXPORTS,"V9J4+R8V Anugraha, Chalad, Kannur, Kerala 670014, India",,Kerala
VAJRA RUBBER PRODUCTS LTD.,"Po, Konathukunnu, Thekkumkara, Kerala 680123, India",,Kerala
VAPSONS EXPORTS,"26, Jawahar St, Gandhi Nagar, Shenoy Nagar, Madurai, Tamil Nadu 625020, India",,Tamil Nadu
VASHINI EXPORTS,"House No B-303 Vashini, Shriram Vijaya Hyyde Park, Duraisamy Layout, Coimbatore, Tamil Nadu 641004, India",,Tamil Nadu
VASULAL INTERNATIONAL,"Kadappuram Rd, Chirakkal, Azhikode, Azhikode South, Kerala 670009, India",,Kerala
VASUNDHARALAYAM COIR WORKS,"P.O,Pin-688525, Muhamma, Kerala 688538, India",,Kerala
VEE KAY GARMENTS,"S.F 369, 2, Angeripalayam Main Rd, SBI Colony, Gandhinagar, Velampalayam, Tiruppur, Tamil Nadu 641603, India",,Tamil Nadu
VEE TECH MACHINES,"F6CV+23X, Ollur Industrial Estate, Ollur, Thrissur, Kerala 680306, India",,Kerala
VEEJAY FINEPLAST,"Veejay Building, No-13-13/6, Mariappan Street, Kattoor, Kattoor, Kattoor Main, Ram Nagar, Coimbatore, Tamil Nadu 641009, India",,Tamil Nadu
VEEKESY FOOTCARE INDIA,"Coimbatore, Tamil Nadu 641032, India",,Tamil Nadu
VEERA HOME TEX,"72,Veera Towers, Sengunthapuram Main Road, Sengunthapuram, Karur, Tamil Nadu 639002, India",,Tamil Nadu
VELAN ENGINEERING,"212 A (Opposite Coimbatore Roller Flour Mills), Sivasakthi Colony, Ganapathy, Coimbatore, Tamil Nadu 641006, India",,Tamil Nadu
VEMBIL EXPORTS,"47VP+4R7, Kaniyampoondi Road, A.Thirumuruganpoondi, Avinashi, Tamil Nadu 641663, India",,Tamil Nadu
VENUS RUBBERS,"SF No. 333/1, Kalappanaiacken Palayam Pirivu, Thadagam Main Rd, Kalappa Naicken Palayam, Coimbatore, Tamil Nadu 641108, India",,Tamil Nadu
VERONICA MARINE EXPORTS P.LTD.,"Neendakara, Kollam, Kerala 691582, India",,Kerala
VESTA ENGINEERS,"5/124-B,Erumathala P.O, Nalamile, Edathala, Aluva, Kerala 683112, India",,Kerala
VETTOOR POLYMERS,"Vettoor-cherunniyoor, Kerala, India",,Kerala
VIGASINI FASHION,"No 69, Periya Thottam, Dharapuram Main Rd, Chandrapuram, Pudur Privu, Tiruppur, Tamil Nadu 641604, India",,Tamil Nadu
VIKAS RUBBERS,"Manarcadu Thengana Road, Thalappady, Kottayam, Kerala 686019, India",,Kerala
VIMALA WELFARE CENTRE,"41/2797, Chittoor Rd, Kacheripady, Ernakulam, Kochi, Kerala 682018, India",,Kerala
VISHNU KNITS,"NO-666/15B, SRI, Guruvayurappan Nagar, AD COLONY NORTH, Poyampalayam, Tiruppur, Tamil Nadu 641602, India",,Tamil Nadu
VITTAL AGRO INDUSTRIES,"95WM+799, Thattummal, Bellur, Kerala 671531, India",,Kerala
VIVID FASHIONS,"SF.No. 708/2,Thatchan Thottam, Govt. Hospital back side, Dharapuram Main Rd, K Chettipalayam, Tiruppur, Tamil Nadu 641608, India",,Tamil Nadu
VYSHAK GARMENTS,"D.No. 259-C & 259-D, Amman Nagar, 3rd Street, Sirupooluvapatti, post, 15, Postal Colony, Velampalayam, Tiruppur, Tamil Nadu 641603, India",,Tamil Nadu
WAYANAD SOCIAL SERVICE SOCIETY,"P.B.No.16, Mananthavady, Kerala 670645, India",,Kerala
WELBOUND WORLDWIDE P.LTD.,"No 28, Al Colony, 3rd Street, West Mambalam, West Mambalam, Manthope Colony, Ashok Nagar, Chennai, Tamil Nadu 600003, India",,Tamil Nadu
WELL KNIT INDUSTRIES,"Door No. 61, 15 Velampalayam Main Road, Opp. Mani's Theatre, Anupparpalayam Post, K Chettipalayam, Tiruppur, Tamil Nadu 641652, India",,Tamil Nadu
WFB BAIRD & CO.(INDIA)P.LTD.,"Plot 45/25, MLA Rd, CSEZ, Kakkanad, Kochi, Kakkanad, Kerala 682037, India",,Kerala
WILTON WEAVERS P.LTD.,"Kalavamkodam, Cherthala, Cherthala, Kerala 688536, India",,Kerala
WINSOME KNIT GARMENTS,"Palavanjipalayam Ring Rd, K Chettipalayam, Tiruppur, Tamil Nadu 641605, India",,Tamil Nadu
WINTRACK EXPORTS,"SF.NO:578, D.NO:37, 1st St, Appachi Nagar, Kongu Nagar, Tiruppur, Tamil Nadu 641607, India",,Tamil Nadu
WYNAD EXPORTS,"Pulimoottil Buildings, Kozhencherry, Kerala 689641, India",,Kerala
YENYESKEY MACHINE TOOLS,"S F, No 362, Thadagam Main Rd, KNG Pudur Pirivu, Coimbatore, Tamil Nadu 641025, India",,Tamil Nadu
ZAINULABDIN GARMENTS,"29, Valayangadu Main Rd, Kumar Nagar, Valayankadu South, Kumar Nagar South, M.N.Sivasubramanian Nagar, Tiruppur, Tamil Nadu 641603, India",,Tamil Nadu
ZALLKAR EXPORTS,"23/575, Kattakayam Rd, Pala, Kerala 686575, India",,Kerala
ZAMANG EXPORTS,"2nd floor, Space Mall, JafferKhan Colony Rd, Mavoor Road, Arayidathupalam, Kozhikode, Kerala 673004, India",,Kerala
ZEBA LAB FURNITURE,"Kinfra Park Kakkanad, Infopark Campus, Kochi, Kakkanad, Kerala 682042, India",,Kerala
ZEHRA TRADING CO.,"Zehra Trading Co, Jew Town Road, Kappalandimukku, Mattancherry, Kochi, Kerala, Marakkadavu, Kappalandimukku, Mattancherry, Kochi, Kerala 682002, India",,Kerala
2F WIND POWER COIMBATORE PVT LTD,"Coimbatore, Tamil Nadu, India",,Tamil Nadu
A.D JAYAVEERAPANDIA,"50, Acharappan St, Kothwal Chavadi, George Town, Chennai, Tamil Nadu 600001, India",,Tamil Nadu
A.K.P.TEX,"Shed No: 26, Palladam Hitech Park, Sukkampalayam, Palladam, Tamil Nadu 641664, India",,Tamil Nadu
AARSHAVEDA WELLNESS PVT LTD,"IX/338, Bank Rd, Aluva, Kochi, Aluva, Kerala 683101, India",,Kerala
AASHMI TRADERS,"Chempakamangalam, Kerala 695104, India",,Kerala
AATHAVA GARMENTS INDIA P.LTD.,"S.F.No 405/1,Bharathi Industrial Area,1st Street, Nava India Rd, Peelamedu, Coimbatore, Tamil Nadu 641004, India",,Tamil Nadu
AATHIRA TRADERS,"S.F. NO: 177/2-C, PLOT NO.20 Salem, Karur Bypass Rd, Karur, Tamil Nadu 639006, India",,Tamil Nadu
ABIRAMI TECHNOLOGIES LTD.,"Arun Raj Building, 93/6, Diwan Bahadur Rd, R.S. Puram, Coimbatore, Tamil Nadu 641002, India",,Tamil Nadu
ACE PACK MACHINES,"No. 23, V. N. Industrial Estate, Bharathi Colony Rd, Sri Kamadhenu Nagar, Coimbatore, Tamil Nadu 641004, India",,Tamil Nadu
AEITS INTERNATIONAL,"VI/1017/22,47,EZHAVA SAMAJAM SHOPPING COMPLEX, North Paravur, Kerala 683513, India",,Kerala
AFRAS CASHEW  TRADERS,"WJC8+2J9, Mangad, Kollam, Kerala 691015, India",,Kerala
AGRO GREEN COIRS,"No.3 KPM Nagar, T . Kottampatty, Mahalakshmi Nagar, Mahalingapuram, Tamil Nadu 642002, India",,Tamil Nadu
AIFFA PLASTICS,"BUILDING NO.13 PEEKEYZ TOWER ROOM NO.130-133 GROUND FLOOR KURIYODAM - AYIKKARAPPADI P.O, Kerala 673637, India",,Kerala
AINULABDIN GAREMNTS,"29, Valayangadu Main Rd, Kumar Nagar, Valayankadu South, Kumar Nagar South, M.N.Sivasubramanian Nagar, Tiruppur, Tamil Nadu 641603, India",,Tamil Nadu
AISHWARYA OVERSEAS EXPORTERS,"Nedumcaud Rd, Killipalam, Karamana, Thiruvananthapuram, Kerala 695002, India",,Kerala
AISWARYA EXPORTS,"Amman koil street, Kongarappattu, Tamil Nadu 604806, India",,Tamil Nadu
AKSARA TEX,"59HG+WM2, Nathampalayam, Tamil Nadu 641666, India",,Tamil Nadu
ALPHA TRADE LINKS,"ALPHA TRADE LINKS, Alamcode, Attingal, Kerala 695101, India",,Kerala
AMMINI SOLAR P.LTD.,"KINFRA Parks, Menamkulam, Kazhakuttom Rd, Pallithura, Thiruvananthapuram, Kerala 695586, India",,Kerala
ANANDHA MODERN RICE MILL,"7369+JJQ Vellore, Rd, Selva Nagar, Vengikkal, Tiruvannamalai, Tamil Nadu 606604, India",,Tamil Nadu
ANURAGAVI GAREMENTS,"48QM+8X9, Unnamed Road, Mahavishnu Nagar, Pitchampalayam Pudur, Tiruppur, Tamil Nadu 641603, India",,Tamil Nadu
AQUA AND EARTH PAPER BAGS,"1, 37, Sri Devi Vaishnavi Nagar A St, Devi Nagar, Oragadam, Chennai, Tamil Nadu 600062, India",,Tamil Nadu
ARAPPURA EXPORTS,"Mundakkal, Kollam, Kerala 691001, India",,Kerala
ARBEE AQUATIC PROTEINS P.LTD.,"Aroor Industrial Estate, NH 47, Aroor gram panchayat, Kochi, Kerala 688534, India",,Kerala
ARUNACHALA GOUNDER TEXTILES,"5, BYE PASS ROAD, Pallipalayam, Tamil Nadu 638006, India",,Tamil Nadu
ASIAN KNIT GARMENTS,"Balu Complex, Chekkukara Thottam, Market Backside, veerapandi, Palladam Road, Tirupur - 4., Tiruppur, Tamil Nadu 641604, India",,Tamil Nadu
ASM EXPORTS,"Post, 8/3764, PN Rd, near P.R.G. Thirumana Mandapam, Anna Nagar, Pooluvapatti, Tiruppur, Tamil Nadu 641602, India",,Tamil Nadu
ASTRA BIOSCIENCE LTD,"Kinfra Koratty Industrial Area Phase I, Koratty, Kerala 680309, India",,Kerala
ATHIRA PLYWOOD,"Ground Floor, Madathil Building, Opp Affinity Towers & Royal Garden Road, Kothaikunnu Bypass Rd, near Private Bus Stand, Thodupuzha, Kerala 685584, India",,Kerala
ATHIYAN EXPORTS,"230 Thenkumarapalayam, Pollachi, Tamil Nadu 642107, India",,Tamil Nadu
AVYA APPARLES,"3W3W+3H4, Koundampalayam, Coimbatore, Tamil Nadu 641029, India",,Tamil Nadu
AZLON ARTS,"157A, Mahatma Gandhi Salai, South Bharathi Nagar, Vaiyapuri Nagar, Green Lands, Karur, Tamil Nadu 639002, India",,Tamil Nadu
BANNARI AMAN SPNG.MILLS LTD.,"Bannari Amman Spinning Mills Ltd Home Textiles Division SF.No.371/3,Karadivavi Road, Karanampet,Paruvai, Post, Saibaba Koil, Coimbatore, Tamil Nadu 641043, India",,Tamil Nadu
BATHSHA MARINE EXPORTS,"Kochi,, V7MW+MJ2, Aroor gram panchayat, Kochi, Kerala 688534, India",,Kerala
BEST KNITTING COMPANY,"Lakshmi Naa, 32, 50 Feet Road, Tirupur, Tirupur, KPN Colony, Valipalayam, Coimbatore, Tiruppur, Tamil Nadu 641602, India",,Tamil Nadu
BESTPAK INDUSTRIES,"Nadakadavu Rd, Palluruthy, Kochi, Kerala 682006, India",,Kerala
BHARATH FLOW CONTROLS,"#7/44-2, Pappanaickenpalayam Road, Kanuvai Industrial Estate, Kanuvai, Kanuvai, Coimbatore, Tamil Nadu 641108, India",,Tamil Nadu
BHAVANI AUTO DISTRIBUTORS,"X7MW+PM5, Kathrikadavu, Kaloor, Ernakulam, Kochi, Kerala 682017, India",,Kerala
BIOGROW SUBSTRATES INDIA,"18 FLAT NO:A07 A 4th FLOOR ALAYAMDYN, SUNDARESA IYYAR L/O, CENTRAL ZONE, Sunderesa Iyer Layout, Highways Colony, Coimbatore, Tamil Nadu 641014, India",,Tamil Nadu
BIOWIN AGRO RESEARCH,"Kartikulam - Mananthavady Rd, Kerala 670646, India",,Kerala
BOSS WEAR EXPORTS,"SF No:130-2A,2, maniyakarapalayam road, Kasipalayam Rd, Kangi Nagar, VGV Vijei garden, Valliammai Nagar, Nallur, Tiruppur, Tamil Nadu 641606, India",,Tamil Nadu
BTS GARMENTS,"2 / 7B, Indra Nagar, 1st Street, Murugapalayam, Avinashi Road, Tiruppur, Tamil Nadu 641603, India",,Tamil Nadu
CALLISTO GARMENTS,"no:15, 4th St, SBI Colony, Gandhinagar, Velampalayam, Tiruppur, Tamil Nadu 641603, India",,Tamil Nadu
CANIMARA EXPORTS,"30/1a, 31, Nehru Street, 15, Velampalayam, Ring Road, Nehru Street, Anupparpalayam Pudur, Tiruppur, A.Thirumuruganpoondi, Tamil Nadu 641652, India",,Tamil Nadu
CCZ INTERNATIONAL,"48WW+C5P, Vengamedu, Poyampalayam, Tiruppur, Tamil Nadu 641602, India",,Tamil Nadu
CEE CEE APPARELS,"State bank colony, 7/1A, opposite Rayapuram Main Road, Rayapuram, Tiruppur, Tamil Nadu COIMBATORE- 641601, India",,Tamil Nadu
