Exporter Name,Address,District,State
5P HORTIPLEX,"19, 2nd St, Balamurugan Nagar, Anna Nagar Extension, Velachery, Chennai, Tamil Nadu 600042, India",,Tamil Nadu
A.A.NUTS,"WJMW+7F7, Chandanathope, Mamoodu, Kerala 14, India",,Kerala
A.K. AHAMED MODERAN RICE MILL,"P.O, 40/2, Mannarpalayam Main Rd, Allikuttai, Salem, Tamil Nadu 636017, India",,Tamil Nadu
A.K.R. TEXTILES,"48W5+XQ9, Velampalayam, A.Thirumuruganpoondi, Tamil Nadu 641652, India",,Tamil Nadu
A.M.FISHERIES,"98WW+WWQ, Valanjavazhy, Ambalapuzha, Kerala 688005, India",,Kerala
A.M.S. TRADING COMPANY,"AMS COMPLEX, VK KADAVU, Road, Nhangattiri, Pattambi, Kerala 679311, India",,Kerala
A.N.P.APPARELS,"48F6+985, MGR Nagar, Sirupooluvapatti, Tiruppur, Tamil Nadu 641687, India",,Tamil Nadu
A.P. GLOBAL MARKETING,"1/126-E, near Pollachi, Devanurpudur, Tamil Nadu 642207, India",,Tamil Nadu
A.P.ENGINEERS,"Ho, Sipcot Industrial Growth Centre, Plot No-C2, near Water Tank, Perundurai, Tamil Nadu 638052, India",,Tamil Nadu
A.S.K. APPARELS,"11/1, Periyar Nagar, West, Karur, Tamil Nadu 639002, India",,Tamil Nadu
A.S.M.KNITS,"5, Singaravelu St, T. Nagar, Chennai, Tamil Nadu 600017, India",,Tamil Nadu
AARGEE ASSOCIATES,"MINI INDUSTRIAL ESTATE, PLOT NO .5, near POLICE STATION, Manarcadu, Kerala 686019, India",,Kerala
AASHA BIOCHEM,"Chorode Panchayath, Chorode, Vatakara, Kerala 673104, India",,Kerala
AAZRA MARINE INDUSTRIES,"Bharath Sea Foods Complex, Chandiroor, Alleppey, Kerala 688547, India",,Kerala
ABAD FISHERIES,"Kochangadi, Chullickal, Kochi, Kerala 682002, India",,Kerala
ABIRAMI EXPORTS,"Shop No.424, Thadagam Main Rd, Near Milk Society Bus Stop, Near Milk Company, R.S. Puram, Coimbatore, Tamil Nadu 641002, India",,Tamil Nadu
ABISHEK EXPORTS,"No.9/76F, South Neervakuzhi, Kanyakumari, Palappallam, Tamil Nadu 629159, India",,Tamil Nadu
ABM MARINE PRODUCTS,"19/2084-E, Nambiapuram Rd, Palluruthy, Kochi, Kerala 682006, India",,Kerala
ACCELERATED FREEZE DRYING CO LTD.,"Accelerated Freeze Drying Co. Ltd. (AFDC, R7CX+HQ6 P.O, Eramallur Ezhupunna Rd, Eramalloor, Ezhupunna, Kerala 688537, India",,Kerala
ACTIVE CHAR PRODUCTS P.LTD.,"Binanipuram, Edayar, Kochi, Kerala 683502, India",,Kerala
ADIL TEXTILES PVT LTD,"Mangalam, Tamil Nadu 641663, India",,Tamil Nadu
ADITI CREATION,"40, South St, Pethi Chetti Puram, Rayapuram, Tiruppur, Tamil Nadu 641601, India",,Tamil Nadu
ADORN GLASS ART,"Near Pampady Gramapanchayth, NH- 220, Pampady Road, Pampady, Kottayam, Pampady, Kerala 686502, India",,Kerala
ADRASH KNITWEAR,"No: 1/H, Avinashi - Tiruppur Rd, near BBC Petrol Pump, Thaneerpanthal, Anupparpalayam Pudur, Tiruppur, A.Thirumuruganpoondi, Tamil Nadu 641652, India",,Tamil Nadu
ADWAITH LAKSHMI INDUSTRIES LTD.,"114 A, Senthottam, Sowri Palayam, Coimbatore, Tamil Nadu 641028, India",,Tamil Nadu
AGAPPE DIAGNOSTICS LTD.,"Agappe Hills, Pattimattom PO, Kochi, Kerala 683562, India",,Kerala
AGARAM KNITTERS,"No 4/571, Palladam Rd, Veerapandi, Tiruppur, Tamil Nadu 641605, India",,Tamil Nadu
AGNI APPARELS,"60, Avinashi - Tiruppur Rd, Kumar Nagar, Park Avenue, Tiruppur, Tamil Nadu 641603, India",,Tamil Nadu
AGRO BROTHERS COIR CO.,"VCMC+GH, Veppampatti, Tamil Nadu 625534, India",,Tamil Nadu
AHILL KNIT EXPORTS,"Shed No. 30, Netaji Apparel Park New, Tiruppur, Tamil Nadu 641666, India",,Tamil Nadu
AHLL KNIT EXPORTS\,"Shed No. 30, Netaji Apparel Park New, Tiruppur, Tamil Nadu 641666, India",,Tamil Nadu
AKAY FLAVOURS & AROMATICS LTD.,"Akanadu, Mudakuzha P.O, Kurichilakodu, Akanad, Kochi, Vengoor West, Kerala 683546, India",,Kerala
AKRUTHI APPARELS,"2/140, Kovil Street, Mangalam Rd, S R Nagar, Tiruppur, Tamil Nadu 641687, India",,Tamil Nadu
AKSHARA GARMENTS,"SF No. 12/3,4,5 - 13/1 - 21/1 , Sasthiri Nagar, Erangattur, Mettupalayam, Sathyamangalam - Mettupalayam Main Rd, South Rangasamuthram, Sathyamangalam, Tamil Nadu 638402, India",,Tamil Nadu
ALAIJA RUBBER FACTORY,"5R6W+2FJ, Kashayapadi, Kozhikode, Feroke, Kerala 673631, India",,Kerala
ALAN TECH INDISTRIAL SOLUTIONS,"Mookkannoor Ezhattumugham Rd, Mookkannoor, Kerala 683577, India",,Kerala
ALBERTS ARTS COLLECTIONS,"X746+P3V, Jew Town Rd, Jew Town, Kappalandimukku, Mattancherry, Kochi, Kerala 682002, India",,Kerala
ALEX MACHINES,"P838+CP5, Kottaram Jn. Rd, Kadakkarappally, Kerala 688529, India",,Kerala
ALLAKKAT INTERNATIONAL,"P.O, Kommady, Thumpoly, Alappuzha, Aryad South, Kerala 688008, India",,Kerala
ALLEPPEY BALERS P.LTD.,"Alappuzha, Kerala, India",,Kerala
ALLEPPEY CO. LTD.,"Alappuzha, Kerala, India",,Kerala
ALPHONSA CASHEW INDUSTRIES,"Puthoor, Kerala 691507, India",,Kerala
AMAZING EXPORT CORPORATION,"SF.No:105,Valayankadu,P.Vadugapalayam Post, Palladam-Dharapuram Rd, Palladam, Tamil Nadu 641664, India",,Tamil Nadu
AMBIKA COTTON MILLS LTD.,"15, Valluvar St, Sivananda Colony, Tatabad, Coimbatore, Tamil Nadu 641012, India",,Tamil Nadu
ANAND TEXTILES,"W8GX+FX8 Moopanpara, Valapattanam, Kerala 670011, India",,Kerala
ANANDHA FABRICATIONS(CBE)P.LTD.,"Thudiyalur Rd, near Indian Oil Petrol Bunk, Saravanampatti, Coimbatore, Tamil Nadu 641006, India",,Tamil Nadu
ANASWARA OFFSET P.LTD,"Edappally Raghavan Pillai Road, Junction, Perandoor, Elamakkara, Kochi, Kerala 682026, India",,Kerala
ANCHUTHARA FOOD PRODUCTS,"MLA Rd, Poochakkal, Cherthala, Panavally, Kerala 688526, India",,Kerala
ANCHUTHENGIL AGRI SUPPLY,"Anchuthengu, Kerala, India",,Kerala
ANGEL CASHEWS,"2QHX+CR5, Thalavoor, Kerala 691560, India",,Kerala
ANJALA EXPORTS,"VIP Nagar Pandian Nagar East Tiruppur, PN Rd, Mummoorthi Nagar, Tiruppur, Tamil Nadu 641602, India",,Tamil Nadu
ANJIPARAMBIL ASSOCIATES,"Parambithara Rd, Panampilly Nagar, Kochi, Kerala 682036, India",,Kerala
ANTHONY GARMENTS,"No. 3, Athimarathottam, Sirupooluvapatti, Tiruppur, Tamil Nadu 641603, India",,Tamil Nadu
ANUGRAHA FASHION MILL P.LTD.,"Garmenting Division Unit-IINO.932 Dharapuram RoadVattamalai, PO, A.P, Pudur, Kangeyam, Tamil Nadu 638701, India",,Tamil Nadu
ANUSAM APPARELS,"Vengamedu, Poyampalayam, Chettipalayam, Tiruppur, Tamil Nadu 641602, India",,Tamil Nadu
AQUA GENO EXIM,"V872+GG9, Keltron Rd, Aroor gram panchayat, Kochi, Kerala 688534, India",,Kerala
AQUA SEAFOOD(INDIA)P.LTD.,"22/1177, Aroor - Thoppumpady Rd, N.H. 47, Edakochi, Kochi, Kerala 682010, India",,Kerala
ARANI EXPORTS,"Arani, Tamil Nadu, India",,Tamil Nadu
ARASAN ALUMINIUM INDUSTRIES,"4, Thiruthangal Rd, Thiruthangal, Sivakasi, Tamil Nadu 626123, India",,Tamil Nadu
ARBEE AGENCIES,"Thattaveli Palam, Velloor, Kerala 686605, India",,Kerala
AREM FASHIONS,"S.F.no 56, Dhanas industrial complex Kasipalayam, Main Rd, Kallangadu, Nallur, Tiruppur, Tamil Nadu 641606, India",,Tamil Nadu
ARMSTRONG KNITTING MILLS (P) LTD.,"61-C, Saminathapuram 2nd street, Anupparpalayam, Velampalayam, Tiruppur, Tamil Nadu 641652, India",,Tamil Nadu
AROMATO EXIM P.LTD.,"458X+7CV, Olavara - Payyanur Rd, Thrikaripur, Kerala 670307, India",,Kerala
ARROW KNITS,"8/823, Vigneshwara Nagar, Pooluvapatti, Tiruppur, Tamil Nadu 641603, India",,Tamil Nadu
ASHJOE COLD CHAIN ESTABLISHMENT,"Road, Aroor gram panchayat, Kochi, Kerala 688534, India",,Kerala
ASMA RUBBER PRODUCTS P. LTD.,"Plot No. 39-B, CSEZ, Kakkanad, Kochi, Kakkanad, Kerala 682037, India",,Kerala
ASSOCIATED TRADERS,"14, Mannar St, T. Nagar, Chennai, Tamil Nadu 600017, India",,Tamil Nadu
ASWATHI EXPORTS,"48Q6+8WF, Velampalayam, Tiruppur, A.Thirumuruganpoondi, Tamil Nadu 641652, India",,Tamil Nadu
ASWATHY ENGINEERING WORKS,"Mukkam - Thiruvambady Rd, Agastiamuzhi, Mukkam, Thondimmal, Kerala 673582, India",,Kerala
ASWIN ASSOCIATES,"XIII/831, Vikas Rd, Karuvelipady, Thoppumpady, Kochi, Kerala 682005, India",,Kerala
ATCHAYA EXPORTS,"3A, Mariamman Koil St, Panruti, Thorapadi, Tamil Nadu 607106, India",,Tamil Nadu
ATCHERRA IMPEX,"14B,PUTHUTHOTTAM, SBI Colony, NARAYANASWAMY NAGAR, Gandhinagar, Velampalayam, Tiruppur, Tamil Nadu 641603, India",,Tamil Nadu
ATHAVAN CLOTHING COMPANY,"10/588E, Acc house mullai nagar Extn, Ganapathipalayam Rd, Chinnakarai, Tiruppur, Tamil Nadu 641605, India",,Tamil Nadu
ATLANTIC CARE CHEMICALS,"Industrial development plot, Punnapra North, Alappuzha, Kerala 688003, India",,Kerala
ATLAS EXPORT ENTERPRISES,"V2P6+G5W, Thalapatti, Tamil Nadu 639003, India",,Tamil Nadu
ATLAS MACHINE TOOLS,"Atlas House Kunnathurmedu, Menna Nagar Colony, Kalmandapam, Palakkad, Kerala 678013, India",,Kerala
AVIRAM KNITTERS,"2nd Street, No. 34-A, PN Rd, Kamaraj Nagar, Tiruppur, Tamil Nadu 641602, India",,Tamil Nadu
AVLA NETTOS EXPORTS,"WGJW+H82, Neendakara - Chinnakkada Rd, Sakthikulangara North, Kollam, Kerala 691581, India",,Kerala
AWA EXPORTS,"T2,Bharat city arcade, Vathukara St, Annamalai Nagar, Woraiyur, Tiruchirappalli, Tamil Nadu 620003, India",,Tamil Nadu
AYKARA PHARMACEUTICALS,"2M96+9MP, Moonnumukku - Uppoodu Road, Mathilakom, Kizhakkekallada, Kerala 691502, India",,Kerala
AYUR PANCHAKARMA EQUIPMENTS,"Velichappat, 3/217 B, Poickattussery, Chengamanad PO Ernakulam District Nedumbassery kurumaseri Road 589P+397, Aluva - Mala Rd, Kerala 683578, Aluva, Kerala 683585, India",,Kerala
B.N.T. CONNECTIONS,"126, Nelson Manickam Rd, Collectorate Colony, Aminjikarai, Chennai, Tamil Nadu 600094, India",,Tamil Nadu
B.S.RUBBERS,"IX/45-N INDUSTRIAL DEVELOPMENT PLOT, Poovanthuruthu, Kerala 686012, India",,Kerala
BABIN TECHNOLOGIES,"5V2R+RX3, Kakkanchery, Chelambra, Kerala 673636, India",,Kerala
BABU COIR WORKS,"Pathirappally Omanappuzha Road, Pattukalam, Alappuzha, Kerala 688522, India",,Kerala
BABU ENGINEERING,"3B, Kamban Street, 1st St N, Ramakrishnapuram, Saravanampatti, Siranandha Puram, Coimbatore, Tamil Nadu 641035, India",,Tamil Nadu
BABY MARINE EASTERN EXPORTS,"Plot No. C-77-A2, C-77B1, Sipcot Industrial Comlex, Madathur, Udumalapetai, Madathur, Thoothukudi, Tamil Nadu 628008, India",,Tamil Nadu
BABY MARINE INTERNATIONAL,"Thoppumpady, W7M8+59J, Thoppumpady, Kochi, Kerala 682005, India",,Kerala
BAFNA ENTERPRISES,"V798+RQR, puthenthode, Kannamaly, Kochi, Kerala 682008, India",,Kerala
BAGAVATHI APPARELS,"5, Angeripalayam Main Road, Jeeva Colony, Gandhi Nagar (PO), SBI Colony, Gandhinagar, Velampalayam, Titupur, Tiruppur, Tamil Nadu 641603, India",,Tamil Nadu
BAKKHUS MERLOT INDUSTRIES,"D-47&48, Municipal Shopping Complex, AM Rd, Perumbavoor, Kerala 683542, India",,Kerala
BALAKRISHNA ENGINEERING,"1/93, Mylampatti Post, near, Chinnampalayam, Coimbatore, Mylampatti, Tamil Nadu 641062, India",,Tamil Nadu
BALU ENGINEERING INDUSTRIES,"2XHP+FRH, Avarampalayam, Illango Nagar, Coimbatore, Tamil Nadu 641006, India",,Tamil Nadu
BANAN GLOBAL TRADING,"Room no.477-C, Gandhinagar West Kechery, Thalakottukara ,India.pin-680501, Kechery, Thalakottukara, Kerala 680501, India",,Kerala
BASCO FOODS (INDIA )PVT. LTD ,"29Q2+WHJ, Edappally - Pukkattupady Rd, Kollamkudimugal, Kangarappady, Kochi, Kerala 682021, India",,Kerala
BASH-P INTERNATIONAL,"2947+MW7, Infopark Campus, Infopark, Kakkanad, Kerala 682030, India",,Kerala
BEEK COTTON CLOTHS,"Amarjothi Gardens, Railway Feeder Road, 485V+46W, Railway Feeder Road, Kannipiran Colony, Valipalayam, Tiruppur, Tamil Nadu 641601, India",,Tamil Nadu
BELL FOODS,"Pallichal Rd, Valummel, Kochi, Kerala 682005, India",,Kerala
BENLION COIR INDUSTRIES,"2/509, Vanchiyapuram Pirivu, Suleeswaranpatti P.O, Pollachi, Annantha Nagar, Coimbatore, Tamil Nadu 642006, India",,Tamil Nadu
BENSO GARMENTS,"pariyur amman nagar, Nochipalayam, Tiruppur, Tamil Nadu 641605, India",,Tamil Nadu
BENZER TRADING INDIA P.LTD.,"Thiruvegappura, Pattambi, Thiruvegappura, Kerala 679304, India",,Kerala
BESCOAT,"Ambalathinkara, Kerala 671531, India",,Kerala
BETHANYA CASHEW COMPANY,"Mavady Post, Enathu Puthoor Rd, Kerala 691507, India",,Kerala
BETHEN PLANTATIONS,"Glenmary Estate, Peerumade (PO), HXGG+78G, Peermade, Idukki, Kuttikkanam, Kerala 685531, India",,Kerala
BETHSAIDA CASHEW COMPANY,"Kollam Kerala, Kerala 691507, India",,Kerala
BHAGYAM EXPORTS,"55, GNG St, Varadaraja Puram, Ambattur, Chennai, Tamil Nadu 600053, India",,Tamil Nadu
BHARATH PAPER CONVERSIONS,"No. 40, 5th Cross, Bharathi Park Rd, Periyar Nagar, Anna Nagar, Coimbatore, Tamil Nadu 641043, India",,Tamil Nadu
BHAVANI FOOD INDUSTRIES,"9HR7+5RM, Thiruvalla, Kerala 689101, India",,Kerala
BIJU MODERN RICE MILL,"Oottara, Kollengode, JPH2+7X8, Panangattiri, Kerala 678504, India",,Kerala
BIPIN EXPORTS,"20, Kongu Main Rd, SNVS Layout, Muthu Nagar, Renganatha Puram, Tiruppur, Tamil Nadu 641607, India",,Tamil Nadu
BIRIN GARMENTS,"57PJ+26C, SH19, Kaikattipudhur, Avinashi, Tamil Nadu 641654, India",,Tamil Nadu
BISMI CASHEWS,"Sengeni Ammal St, Panruti, Tamil Nadu 607106, India",,Tamil Nadu
BISMI TRADING COMPANY,"EEC Market, Market P.O, Vazhappily, Muvattupuzha, Kerala 686673, India",,Kerala
BISMILLAH AGRI COMMODITIES,"HMD BUILDING, 18/1640, Karicode, Koikkal, Kollam, Kerala 691004, India",,Kerala
BLASTLINE  INDIA,"48/2510D4, 2nd Floor, Blastline Corporate Chamber,Pottakuzhi Elamakkakara (PO, Perandoor Rd, Mamangalam, Kaloor, Ernakulam, Kochi, Kerala 682026, India",,Kerala
BLOOMS ENGINEERING,"682 F, Mundur, Thrissur, Kerala 680541, India",,Kerala
BLOSSOM APPARELS,"1058, Munusamy Salai, KK Nagar West, K. K. Nagar, Chennai, Tamil Nadu 600078, India",,Tamil Nadu
BLUE BREEZE ENTERPRISE,"SIDCO, Tamil Nadu 641606, India",,Tamil Nadu
BLUEMOUNTAIN EXPORTERS,"14/486, East, Pandikudy, Chullickal, Kochi, Kerala 682001, India",,Kerala
BOS NATURAL FLAVORS P.LTD.,"Asian House” P.P Road, Pathipalam Allapra (P.O, Perumbavoor Puthencruz Rd, Perumbavoor, Kerala 683553, India",,Kerala
BOSE EXPORTS,"48FH+P3M, Asher Nagar 60 Feet Rd, Valayankadu South, Tiruppur, Tamil Nadu 641603, India",,Tamil Nadu
BRIGHT ENGINEERING COMPANY,"lakshmi, Ganesh Nagar 3rd St, Lakshmi Nagar, Koundampalayam, Coimbatore, Tamil Nadu 641030, India",,Tamil Nadu
BRITE GARMENTS,"47/1, Periyar St, Erode, Tamil Nadu 638003, India",,Tamil Nadu
BROS INDIA GROUP,"J9C6+WCC, Kayippuram, Muhamma, Kerala 688525, India",,Kerala
BUSTHAN AL WATHANIYA,"P9V4+QVH, Pallipuram, Kerala 688541, India",,Kerala
C.P. EXPORTS,"56, S Car St, Teppam South Bazar, Anna Nagar, Virudhunagar, Tamil Nadu 626001, India",,Tamil Nadu
C.R.GARMENTS,"330/1, Sri Gokula Krishna Nagar Tkt Mills, Palladam Road, Tiruppur - Palladam Rd, AB Nagar, Tiruppur, Tamil Nadu 641605, India",,Tamil Nadu
C.R.I.RUBBERS,"XI /799, VIJAYAPURAM, Vadavathoor, Kottayam, Kerala 686010, India",,Kerala
C.S. GARMENTS,"42, Karumarampalayam Rd, Karumarpalayam, Mannarai, Tiruppur, Tamil Nadu 641607, India",,Tamil Nadu
C.V.S.EXPORTS,"28/4, Millers Rd, Kilpauk, Chennai, Tamil Nadu 600010, India",,Tamil Nadu
CALMET ENGINEERING,"3/176, SS no - 419/5D, Maniyavi Thottam West Arasur, SulurTaluk, Amman Nagar, Coimbatore, Tamil Nadu 641407, India",,Tamil Nadu
CANDOUR TEXPORT,"103, Street, Kozhipannai, Andipalayam, Tiruppur, Tamil Nadu 641687, India",,Tamil Nadu
CANNANORE HANDLOOM EXPORTS,"V9FW+8MW, Elayavoor, Kerala 670005, India",,Kerala
CANNANORE HOME FURNISHINGS,"Manuelsons, Complex, GH Rd, Mananchira, Kozhikode, Kerala 673001, India",,Kerala
CANNING INDS. COCHIN LTD.,"G65M+4WR, Caico Rd, Maveli Nagar, Unity Nagar, Kuriachira, Thrissur, Kerala 680006, India",,Kerala
CANON BALL FASHIONS,"5C6J+J64, Kavandampalayam, Tamil Nadu 638752, India",,Tamil Nadu
CARONA KNITWEAR,"1,Bridgeway Colony, Extention North, Bridge Way Colony Extension, Tiruppur, Tamil Nadu 641607, India",,Tamil Nadu
CARRIS PIPES,"P.B. No.2, Koovappady P.O, Akanad, Kerala 683544, India",,Kerala
CAT COIR,"Coir park 1 Thiruvizha North Road, Post, Mayithara, Cherthala South, Kerala 688539, India",,Kerala
CATHOLIC ART CENTRE,"Broadway, Church St, Marine Drive, Ernakulam, Kochi, Kerala 682031, India",,Kerala
CBC FASHIONS,"No.11, M. R. Nagar, Dharapuram Main Rd, MR Nagar, K N P Colony, Tiruppur, Tamil Nadu 641604, India",,Tamil Nadu
CEAKAY INDUSTRIES,"Ponpuzha, Ithithanam Post, Changanacherry Near Saintgits college, Pathamuttom, Kottayam, Ithithanam, Kerala 686535, India",,Kerala
CEE BEE EXPORTS,"582M+VXG, Vengamedu, Mangulam, Tiruppur, Tamil Nadu 641603, India",,Tamil Nadu
CHAITHANYA HERBALS,"Naruvamoodu, Pallichal, Kerala 695507, India",,Kerala
CHANDRA CASHEW FACTORY,"2PCC+JGV, Thevalapuram, Neduvathoor, Kerala 691507, India",,Kerala
CHARANKATTU COIR MFG.CO.P.LTD.,"AS Road, J84M+GF5, Kanjikuzhy, Shertallay, Kerala 688524, India",,Kerala
CHARLY FISHERIES,"WGPV+RXG, Neendakara, Kollam, Kerala 691582, India",,Kerala
CHEETAH GARMENS,"396M+769, Tiruppur, Tamil Nadu 641605, India",,Tamil Nadu
CHEMMEENS (REGD),"Chemmeens Junction,Karuvekipady, Kochi-682005, Karuvelipady, Kazhuthumuttu, Thoppumpady, Kochi, Kerala 682005, India",,Kerala
CHERISH KNITS,"81, 2nd Street, New Ramakrishna Puram Mordan Bakery Street, Muthu Nagar, Renganatha Puram, Tiruppur, Tamil Nadu 641607, India",,Tamil Nadu
CHERUKATTU INDUSTRIES,"V8C7+3QX Cherukattu Industries, Aroor gram panchayat, Kochi, Kerala 688534, India",,Kerala
CHETHANA PHARMACEUTICALS,"X6CJ+F69, Shanti Nagar, Perintalmanna, Kerala 679322, India",,Kerala
CHIPPY EXPORTS,"Pitchampalayam Pudur, Tiruppur, Tamil Nadu 641603, India",,Tamil Nadu
CHRISTY APPARELS,"SR Nagar, Periyandipalayam, Tiruppur, Tamil Nadu 641687, India",,Tamil Nadu
CII GUARDIAN INTERNATIONAL LTD.,"16B, CSEZ, Kakkanad, Kerala 682037, India",,Kerala
CLAIRON FILTERS,"Plot. No.41, 37, CSEZ, Kakkanad, Kochi, Kakkanad, Kerala 682037, India",,Kerala
CLASSIC COIR FACTORY,"IV/833, MSP, Valavanad, Pollethai, Alappuzha, Kerala 688522, India",,Kerala
CLASSIC COOLING TOWERS,"No. 566, Swaminathapuram Village, Vadavalli, Panchayat, Taluk, Annur, Tamil Nadu 641697, India",,Tamil Nadu
COCHIN CADALAS P.LTD.,"Kochi, Kerala, India",,Kerala
COCHIN CONDIMENTS P.LTD.,"Kochi, Kerala, India",,Kerala
COCHIN COSMOS FOODS LTD.,"Kochi, Kerala, India",,Kerala
COCHIN DIES AND MOULDS,"Kochi, Kerala, India",,Kerala
COCHIN EXPORTS,"Federal Park, Vennala, Ernakulam, Kochi, Kerala 682028, India",,Kerala
COCHIN EXPORTS  ,"Federal Park, Vennala, Ernakulam, Kochi, Kerala 682028, India",,Kerala
COCHIN FROZEN FOOD EXPORTS P. LTD.,"Kochi, Kerala, India",,Kerala
COCHIN MINERALS AND RUTILE LTD.,"Poorna Nagar Park,, 4952+GWW, Periyar Nagar, Aluva, Kerala 683101, India",,Kerala
COCHIN RECLAIM & RUBBER,"Kochi, Kerala, India",,Kerala
COCHIN RUBBER INDUSTRIES,"Kochi, Kerala, India",,Kerala
COCHIN RUBBERS,"23B, Major, Industrial Estate, South Kalamassery, Kalamassery, Kochi, Kerala 683109, India",,Kerala
COCHIN SURFACTANTS P.LTD.,"PLOT no 63, Edayar, Kerala 683502, India",,Kerala
COCHIN TRADERS COCHIN,"20/46B, Near I.O.C Petrol Pump, Palluruthy Veli, Aroor - Thoppumpady Rd, Palluruthy, Kochi, Kerala 682006, India",,Kerala
COCO  FIBRE TEX,"G83H+F9Q, Aarattuvazhi, Kanjiramchira, Aryad South, Alappuzha, Kerala 688007, India",,Kerala
COIMBATORE POTTERIES & REFRACTORIES,"Coimbatore, Tamil Nadu, India",,Tamil Nadu
COIR FLEX,"Building No.X11, Pattanakkad, Cherthala, Pattanakkad, Kerala 688531, India",,Kerala
COIR FLOOR FURNISHING CO.,"Kalyan Villa, Vellakinar Rd, Vellakkinar, Alappuzha, Kerala 688001, India",,Kerala
COIR MATES INDIA,"TP-12/498K, Varanad PO, Cherthala, Pin: 688539, Alappuzha, Cherthala, Kerala 688524, India",,Kerala
COMET EXPORTS,"J88R+699, Kanjikuzhy, Kanjikkuzhi, Kerala 688525, India",,Kerala
CONSOLIDATED WOOD INDUSTRIES,"Chingavanam, Kerala 686007, India",,Kerala
COONOOR TEA ESTATES CO. LTD.,"Coonoor, Tamil Nadu, India",,Tamil Nadu
COSMIK INDUSTRY,"514/7, Pothiyampalayam, Road, Arasur, Tamil Nadu 641407, India",,Tamil Nadu
COTTAGE ARTS EMPORIUM,"No. 29, TT Krishnamachari Rd, CIT Colony, Mylapore, Chennai, Tamil Nadu 600018, India",,Tamil Nadu
COTTON BUDS INC.,"2a, PN Rd, Palanisamy Nagar, Vengamedu, Poyampalayam, Tiruppur, Tamil Nadu 641602, India",,Tamil Nadu
COVAI EXIM,"B No.10-1, Krishna Nagar, Maniyarkaranpalayam Road, Periyar Nagar, Anna Nagar, Coimbatore, Tamil Nadu 641006, India",,Tamil Nadu
COVEMA FILAMENTS LTD.,"14-B, CSEZ, Kakkanad, Kerala 682037, India",,Kerala
CPS TEXTILES P. LTD.,"26A, Kangayam Rd, opp. JMHS School, Kaliyappa Nagar, Cheran Nagar, Lakshmi Garden, Tiruppur, Tamil Nadu 641604, India",,Tamil Nadu
CRAFT INDIA FOOTWEAR CALICUT,"Kozhikode, Kerala, India",,Kerala
CRAFT KNIT GARMENTS,"4/684 Nochipalayam Road Veerapandi Post, Palladam Rd, Tiruppur, Tamil Nadu 641605, India",,Tamil Nadu
CRESCENT INTERNATIONAL TYRE TREADS,"9/22 HA IDA, Nalam Mile, ALUVA, Kerala 683112, India",,Kerala
CROSSINGS INTERNATIONAL DISTRIBUTION,"682037, CSEZ, Kochi, Kakkanad, Kerala 682037, India",,Kerala
D.C. MILLS,"Valavanadu, Kalavoor P.O., Kanjikuzhy, Ward 1, Alappuzha, Kerala 688522, India",,Kerala
D.M.G EXPORTS,"42/60, Kumar Nagar, Renganatha Puram, Tiruppur, Tamil Nadu 641602, India",,Tamil Nadu
D.S.P. KNITTING COMPANY,"Bridge Way Colony Extension, Tiruppur, Tamil Nadu 641602, India",,Tamil Nadu
D.V. DEO INDUSTRIAL LTD.,"PLOT NO 9 MAJOR, Industrial Estate, South Kalamassery, Kalamassery, Kochi, Kerala 683109, India",,Kerala
D.V.DEO INDUSTRIAL LTD.,"PLOT NO 9 MAJOR, Industrial Estate, South Kalamassery, Kalamassery, Kochi, Kerala 683109, India",,Kerala
D2D INTERNATIONAL,"1/37, Nochipalayam, Veerapandi, Tiruppur, Tamil Nadu 641605, India",,Tamil Nadu
DECE TOOLS,"2XXQ+F5F, Gopalakrishnapuram, Ganapathy, Coimbatore, Tamil Nadu 641006, India",,Tamil Nadu
DECO DE TREND,"Sriperumbudur Taluk, 4/371, Vandalur - Wallajabad Road, David Nagar, Padappai, Chennai, Tamil Nadu 601301, India",,Tamil Nadu
DEEKAY KNITWEARS,"SF NO.229, KARAIPUDHUR ARULPURAM, PALLADAM, RAOD, Arulpuram, Tiruppur, Tamil Nadu 641605, India",,Tamil Nadu
DEEPA AGENCIES,"39/1384 Four Star Buildings Chittoor Road Valanjambalam, Ernakulam South, Kochi, Kerala 682016, India",,Kerala
DELSEA EXPORTS P.LTD.,"Nambiapuram, Palluruthy, Kochi, Kerala 682006, India",,Kerala
DELTA PLYWOODS AND BOARDS,"Iringole Rd, PO, Perumbavoor, Kerala 683548, India",,Kerala
DEVICOLAM DISTILLERIES LTD,"Parakkamugal Infopark Rd, Infopark Campus, Kochi, Kakkanad, Kerala 682030, India",,Kerala
DHANALAKSHMI WEAVING WORKS,"AKG Nagar Housing Colony, Kakkat, Kannur, Kerala 670005, India",,Kerala
DHANAM EXPORTS,"3/247, Senthil Nagar, Ganapathi Palayam, Kangayam Main Road, Tamilnadu, Padiyur, Nachipalayam, Tamil Nadu 638701, India",,Tamil Nadu
DHANAM TEXTILES,"30, Coral Merchant Street, Mannadi, George Town, Chennai, Tamil Nadu 600001, India",,Tamil Nadu
DOLPHIN RUBBER INDUSTRIES,"Industrial Development Plot, Poovanthuruthu, Kottayam, Kerala 686012, India",,Kerala
DON TEX,"8/24 F ANGERIPALAYAM ROAD OPP.KONGU VELLALAR SCHOOL TIRUPUR, Mahavishnu Nagar, Pitchampalayam Pudur, Tiruppur, Tamil Nadu 641603, India",,Tamil Nadu
DREAMS EXPORTS,"7G3C+5GX, Thattarambalam, Mavelikara, Kannamangalam North, Kerala 690103, India",,Kerala
DUINKOP ENTERPRISES P.LTD.,"Dasanaikenpalayam (po), Pollachi TK, SF 58, Palladam Main Road, Pongalur, Tamil Nadu 642202, India",,Tamil Nadu
DURO OVERSEAS TRDING HOUSE,"1143, Mettupalayam Rd, near Murugan Mills, Nesavaalar Colony, Coimbatore, Tamil Nadu 641043, India",,Tamil Nadu
DUSTAN WOOD,"Kurichy, Thuruthy, Kerala 686532, India",,Kerala
DYNAMIC TECHNO MEDICALS PVT. LTD.,"Kodikuthimala, Ashokapuram, Edathala, Aluva, Kerala 683101, India",,Kerala
EASTERN ENGINEERS,"SF.No.418,Karukkankattor pirivu,Covai main road, Perundurai, Tamil Nadu 638052, India",,Tamil Nadu
EASTERN RUG MILLS,"CCSB Rd, Civil Station Ward, Alappuzha, Kerala 688001, India",,Kerala
EGATE INTERNATIONAL,"Lane 1, VRWA, near State Bank of India, Vyttila, Ernakulam, Kochi, Kerala 682019, India",,Kerala
ELAN EXPORTS,"37QR+8H7, Tiruppur, Tamil Nadu 641687, India",,Tamil Nadu
ELUMALAI APPARELS,"Gandhi Road, Opposite To Nataraja Sabari Garden,, D-1, Anupparpalayam Pudur, Tiruppur, A.Thirumuruganpoondi, Tamil Nadu 641652, India",,Tamil Nadu
EMIL TRADERS P.LTD.,"M567+639, Meenangadi, Kerala 673591, India",,Kerala
EMINENT MINI STORES,"7/808, Court Rd, Near Central Fish Market, Mananchira, Kozhikode, Kerala 673001, India",,Kerala
EMMANUEL CASHEW INDUSTRIES,"WRP4+F59, Konnathu Mukku - Mathayi Mukku Rd, Chepra, Kerala 691520, India",,Kerala
EMPEROR TEXTILES,"Nh 47 Main Road, SS Nagar, Tiruppur, Tamil Nadu 641666, India",,Tamil Nadu
ENGINEERED  ELASTOMER SOLUTIONS CO.,"SDF 16A, IVth Floor, CSEZ, Kakkanad, Kochi, Kakkanad, Kerala 682037, India",,Kerala
ENJAYES SPICES & CHEMICAL OILS (P) LTD.,"Spices Hill, Vallicode, Pathanamthitta, Kottayam, Vallicode Kottayam, Kerala 689656, India",,Kerala
ENTICE GARMENTS,"No.2, to Muthanampalayam Road, Muthanampalayam (Post),, Nallur, Tiruppur, Tamil Nadu 641606, India",,Tamil Nadu
ESCON CHEMICAL COMPANY,"423 A South vellarapilly, po, Kochi, Thekkumbhagom, Kerala 683580, India",,Kerala
ESM TEXTILES,"9FXW+32J, Dhalavaipuram, Tamil Nadu 626188, India",,Tamil Nadu
ESMARIO EXPORT ENTERPRISES,"WHH6+WJW, Kavanad, Sakthikulangara North, Kollam, Kerala 691003, India",,Kerala
ESS GEE GARMENTS,"No:7, MS Nagar 2nd Street, Asirwatham Stores, Kondu Main Road, Appachi Nagar, Kongu Nagar, Tiruppur, Tamil Nadu 641607, India",,Tamil Nadu
ESS PEE KNIT WEAR,"Kangayam Rd, Rajiv Nagar, Bavani Nagar, Tiruppur, Tamil Nadu 641602, India",,Tamil Nadu
ESSA GARMENTS,"10, Pushpa Nagr, Kangayam Cross Road, Kannipiran Colony, Binny Compound, Tiruppur, Tamil Nadu 641604, India",,Tamil Nadu
ESTILO FASHIONS,"C100, 1'ST AVENUE, Chintamani, C Block, Annanagar East, Chennai, Tamil Nadu 600102, India",,Tamil Nadu
EVEREST WOOD INDUSTRIES,"Xix/318 Kanjirakkadu, Rayonpuram P.O, Perumbavoor Kochi- 683543, Kerala, Ernakulam, Perumbavoor, Kerala 683543, India",,Kerala
EVERGREEN EXPORTS,"Willingdon Island, Kochi, Kerala 682003, India",,Kerala
EVERGREEN SORTING TECHNOLOGIES,"519, Athipalayam Rd, Sreevatsa Global Village, Chinnavedampatti, Coimbatore, Tamil Nadu 641049, India",,Tamil Nadu
EXCEL IMPEX,"Excel Tower, 7/138 B, Puranattukara, Kerala 680551, India",,Kerala
EXCEL LEATHERS,"Near KSEB, 68/1637A, Mariakutty John Rd, near Power House Road, Power House Junction, Kacheripady, Kochi, Kerala 682018, India",,Kerala
EXIM KNITTERS,"No-1, L I C Colony, 1st Street, College Road, College Road, Odakkadu, Tiruppur, Tamil Nadu 641602, India",,Tamil Nadu
F.G.TRADING COMPANY,"Room No:40/5476, First Floor,Ruquia Chamber, TD Rd, Padma Junction, Pullepady, Kochi, Kerala 682035, India",,Kerala
FABRO TEXTILES,"48H4+2W8, Thiruvanakudi Nagar, Sirupooluvapatti, Tiruppur, Tamil Nadu 641652, India",,Tamil Nadu
